id,related_id,slug,title,presenterDisplayName
564897,130446,saamra_mekuria_grillo_yes_you_can_be_an_entrepreneur_too,"Yes, you can be an entrepreneur too",Saamra Mekuria-Grillo
564897,75762,tai_simpson_the_intergenerational_wisdom_woven_into_indigenous_stories,The intergenerational wisdom woven into Indigenous stories,Tai Simpson
564897,101215,valerie_courtois_how_indigenous_guardians_protect_the_planet_and_humanity,How Indigenous guardians protect the planet and humanity,Valérie Courtois
564897,1930,roselinde_torres_what_it_takes_to_be_a_great_leader,What it takes to be a great leader,Roselinde Torres
564897,1189,maajid_nawaz_a_global_culture_to_fight_extremism,A global culture to fight extremism,Maajid Nawaz
564897,156,patrick_awuah_how_to_educate_leaders_liberal_arts,How to educate leaders? Liberal arts,Patrick Awuah
563991,143892,jon_youshaei_is_perfectionism_just_procrastination_in_disguise,Is perfectionism just procrastination in disguise?,Jon Youshaei
563991,113488,yara_shahidi_let_curiosity_lead,Let curiosity lead,Yara Shahidi
563991,134464,rupaul_charles_bravery_brilliance_and_rupaul_charles_on_the_spot,"Bravery, brilliance and RuPaul Charles | On the Spot",RuPaul Charles
563991,1841,andrew_fitzgerald_adventures_in_twitter_fiction,Adventures in Twitter fiction,Andrew Fitzgerald
563991,1379,andrew_stanton_the_clues_to_a_great_story,The clues to a great story,Andrew Stanton
563991,1653,young_ha_kim_be_an_artist_right_now,"Be an artist, right now!",Young-ha Kim
564936,123235,chris_anderson_it_s_time_for_infectious_generosity_here_s_how,It's time for infectious generosity. Here's how,Chris Anderson
564936,125969,chris_anderson_and_richard_saul_wurman_ted_is_40_here_s_how_it_all_started,TED is 40 — here's how it all started,Chris Anderson and Richard Saul Wurman
564936,211,chris_anderson_ted_s_nonprofit_transition,TED's nonprofit transition,Chris Anderson
564936,1066,johanna_blakley_social_media_and_the_end_of_gender,Social media and the end of gender,Johanna Blakley
564936,75,sasa_vucinic_why_we_should_invest_in_a_free_press,Why we should invest in a free press,Sasa Vucinic
564936,575,clay_shirky_how_social_media_can_make_history,How social media can make history,Clay Shirky
564740,140233,stephanie_r_yates_anyabwile_your_relationship_expectations_could_be_holding_you_back,Your relationship expectations could be holding you back,Stephanie R. Yates-Anyabwile
564740,139335,ethan_kross_do_you_talk_to_yourself_here_s_how_to_harness_your_inner_voice,Do you talk to yourself? Here’s how to harness your inner voice,Ethan Kross
564740,140318,rhaina_cohen_why_friendship_can_be_just_as_meaningful_as_romantic_love,Why friendship can be just as meaningful as romantic love,Rhaina Cohen
564740,9463,susan_david_the_gift_and_power_of_emotional_courage,The gift and power of emotional courage,Susan David
564740,7592,tiffany_watt_smith_the_history_of_human_emotions,The history of human emotions,Tiffany Watt Smith
564740,2279,rana_el_kaliouby_this_app_knows_how_you_feel_from_the_look_on_your_face,This app knows how you feel -- from the look on your face,Rana el Kaliouby
564489,145498,elizabeth_cox_should_we_get_rid_of_pregnancy_ada_ep_3,"Should we get rid of pregnancy? | Ada, Ep. 3",Elizabeth Cox
564489,146164,elizabeth_cox_can_we_actually_control_superintelligent_ai_ada_ep_4,"Can we actually control superintelligent AI? | Ada, Ep. 4",Elizabeth Cox
564489,145422,elizabeth_cox_how_to_survive_the_apocalypse_ada_ep_1,"How to survive the apocalypse | Ada, Ep. 1",Elizabeth Cox
557037,121579,jessica_apotheker_what_will_happen_to_marketing_in_the_age_of_ai,What will happen to marketing in the age of AI?,Jessica Apotheker
557037,138141,mark_abraham_the_power_of_personalization_in_the_age_of_ai,The power of personalization in the age of AI,Mark Abraham
557037,121069,cathie_wood_why_ai_will_spark_exponential_economic_growth,Why AI will spark exponential economic growth,Cathie Wood
557037,2841,tom_gruber_how_ai_can_enhance_our_memory_work_and_social_lives,"How AI can enhance our memory, work and social lives",Tom Gruber
557037,2645,kevin_kelly_how_ai_can_bring_on_a_second_industrial_revolution,How AI can bring on a second Industrial Revolution,Kevin Kelly
557037,20368,kai_fu_lee_how_ai_can_save_our_humanity,How AI can save our humanity,Kai-Fu Lee
561608,108693,alexandra_horowitz_why_all_dogs_are_good_dogs,Why all dogs are good dogs,Alexandra Horowitz
561608,137298,glen_j_golden_can_dogs_detect_the_next_pandemic_before_it_begins,Can dogs detect the next pandemic before it begins?,Glen J. Golden
561608,37122,david_ian_howe_a_brief_history_of_dogs,A brief history of dogs,David Ian Howe
561608,328,ian_dunbar_dog_friendly_dog_training,Dog-friendly dog training,Ian Dunbar
561608,2031,billy_collins_two_poems_about_what_dogs_think_probably,Two poems about what dogs think (probably),Billy Collins
561608,2066,laurel_braitman_depressed_dogs_cats_with_ocd_what_animal_madness_means_for_us_humans,"Depressed dogs, cats with OCD — what animal madness means for us humans",Laurel Braitman
564979,93115,ted_health_how_to_manage_your_stress_like_an_er_doctor,How to manage your stress like an ER doctor,TED Health
564979,126807,ted_health_the_bias_behind_your_undiagnosed_chronic_pain,The bias behind your undiagnosed chronic pain ,TED Health
564979,141972,ted_health_a_healthier_you_a_5_step_guide_to_better_doctor_visits,A Healthier You: A 5-step guide to better doctor visits,TED Health
564105,121817,ted_countdown_ted_explores_a_new_climate_vision,TED Explores: A New Climate Vision,TED Countdown
564105,108932,ted_countdown_how_do_we_get_the_world_off_fossil_fuels_quickly_and_fairly,How do we get the world off fossil fuels quickly and fairly?,TED Countdown
564105,132784,uma_valeti_is_cultivated_meat_the_future_of_food,Is cultivated meat the future of food?,Uma Valeti
564105,263,mark_bittman_what_s_wrong_with_what_we_eat,What's wrong with what we eat,Mark Bittman
564105,1565,tristram_stuart_the_global_food_waste_scandal,The global food waste scandal,Tristram Stuart
564105,1199,josette_sheeran_ending_hunger_now,Ending hunger now,Josette Sheeran
560004,142043,elise_hu_how_digital_culture_is_reshaping_our_faces_and_bodies,How digital culture is reshaping our faces and bodies,Elise Hu
560004,145078,jenny_hoyos_the_secret_to_telling_a_great_story_in_less_than_60_seconds,The secret to telling a great story — in less than 60 seconds,Jenny Hoyos
560004,141871,david_suh_why_body_language_is_the_key_to_self_expression_and_hot_selfies,Why body language is the key to self-expression — and hot selfies,David Suh
560004,1747,phil_hansen_embrace_the_shake,Embrace the shake,Phil Hansen
560004,1653,young_ha_kim_be_an_artist_right_now,"Be an artist, right now!",Young-ha Kim
560004,1169,shea_hembrey_how_i_became_100_artists,How I became 100 artists,Shea Hembrey
563989,123149,ted_ed_how_to_get_motivated_even_when_you_don_t_feel_like_it,How to get motivated even when you don’t feel like it, TED-Ed
563989,141639,shannon_odell_how_to_make_your_stress_work_for_you,How to make your stress work for you,Shannon Odell
563989,104637,ted_ed_how_to_manage_your_emotions,How to manage your emotions, TED-Ed
563709,141561,chin_teng_lin_the_mind_reading_potential_of_ai,The mind-reading potential of AI,Chin-Teng Lin
563709,140425,jennifer_golbeck_is_ai_progress_stuck,Is AI progress stuck?,Jennifer Golbeck
563709,138369,katsuhiko_hayashi_a_mouse_with_two_dads_and_a_new_frontier_for_biology,A mouse with two dads — and a new frontier for biology,Katsuhiko Hayashi
563709,2841,tom_gruber_how_ai_can_enhance_our_memory_work_and_social_lives,"How AI can enhance our memory, work and social lives",Tom Gruber
563709,2645,kevin_kelly_how_ai_can_bring_on_a_second_industrial_revolution,How AI can bring on a second Industrial Revolution,Kevin Kelly
563709,17851,max_tegmark_how_to_get_empowered_not_overpowered_by_ai,"How to get empowered, not overpowered, by AI",Max Tegmark
549027,85259,jamil_zaki_how_to_escape_the_cynicism_trap,How to escape the cynicism trap,Jamil Zaki
549027,135550,ayelet_fishbach_how_to_set_the_right_goals_and_stay_motivated,How to set the right goals and stay motivated,Ayelet Fishbach
549027,117012,ted_ed_why_is_it_so_hard_to_break_a_bad_habit,Why is it so hard to break a bad habit?,TED-Ed
549027,1928,rupal_patel_synthetic_voices_as_unique_as_fingerprints,"Synthetic voices, as unique as fingerprints",Rupal Patel
549027,5990,rebecca_kleinberger_why_you_don_t_like_the_sound_of_your_own_voice,Why you don't like the sound of your own voice,Rébecca Kleinberger
549027,20044,shaylin_schundler_why_does_your_voice_change_as_you_get_older,Why does your voice change as you get older?,Shaylin Schundler
563582,138323,norah_magero_this_refrigerator_is_saving_lives,This refrigerator is saving lives ,Norah Magero
563582,119530,john_o_donnell_can_a_simple_brick_be_the_next_great_battery,Can a simple brick be the next great battery?,John O'Donnell
563582,126754,tombo_banda_meet_mini_grids_the_clean_energy_solution_bringing_power_to_millions,Meet mini-grids — the clean energy solution bringing power to millions,Tombo Banda
563582,1754,alex_laskey_how_behavioral_science_can_lower_your_energy_bill,How behavioral science can lower your energy bill,Alex Laskey
563582,1434,amory_lovins_a_40_year_plan_for_energy,A 40-year plan for energy,Amory Lovins
563582,1207,alex_steffen_the_shareable_future_of_cities,The shareable future of cities,Alex Steffen
564124,145497,elizabeth_cox_would_you_sell_your_kidney_for_100_000_ada_ep_2,"Would you sell your kidney for $100,000? | Ada, Ep. 2",Elizabeth Cox
564124,145498,elizabeth_cox_should_we_get_rid_of_pregnancy_ada_ep_3,"Should we get rid of pregnancy? | Ada, Ep. 3",Elizabeth Cox
564124,146164,elizabeth_cox_can_we_actually_control_superintelligent_ai_ada_ep_4,"Can we actually control superintelligent AI? | Ada, Ep. 4",Elizabeth Cox
563537,142043,elise_hu_how_digital_culture_is_reshaping_our_faces_and_bodies,How digital culture is reshaping our faces and bodies,Elise Hu
563537,142127,martin_j_eppler_want_to_give_a_great_presentation_use_ugly_sketches,Want to give a great presentation? Use ugly sketches,Martin J. Eppler
563537,113488,yara_shahidi_let_curiosity_lead,Let curiosity lead,Yara Shahidi
563537,1066,johanna_blakley_social_media_and_the_end_of_gender,Social media and the end of gender,Johanna Blakley
563537,575,clay_shirky_how_social_media_can_make_history,How social media can make history,Clay Shirky
563537,2073,sally_kohn_don_t_like_clickbait_don_t_click,Don't like clickbait? Don't click,Sally Kohn
563460,41105,matt_walker_sleep_is_your_superpower,Sleep is your superpower,Matt Walker
563460,129908,anna_rothschild_what_staying_up_all_night_does_to_your_brain,What staying up all night does to your brain,Anna Rothschild
563460,93273,craig_richard_the_brain_science_and_benefits_of_asmr,The brain science (and benefits) of ASMR,Craig Richard
563460,3686,dan_gartenberg_the_brain_benefits_of_deep_sleep_and_how_to_get_more_of_it,The brain benefits of deep sleep -- and how to get more of it,Dan Gartenberg
563460,1810,russell_foster_why_do_we_sleep,Why do we sleep?,Russell Foster
563460,1044,arianna_huffington_how_to_succeed_get_more_sleep,How to succeed? Get more sleep,Arianna Huffington
555877,139886,teri_hofford_why_you_think_you_look_bad_in_photos,Why you think you look bad in photos,Teri Hofford
555877,115776,misan_harriman_the_power_of_an_image_and_the_mind_behind_it,The power of an image — and the mind behind it,Misan Harriman
555877,95046,platon_stories_of_photographing_monumental_people_from_michelle_obama_to_stephen_hawking,Stories of photographing monumental people -- from Michelle Obama to Stephen Hawking, Platon
555877,3257,uldus_bakhtiozina_portraits_that_transform_people_into_whatever_they_want_to_be,Portraits that transform people into whatever they want to be,Uldus Bakhtiozina
555877,1193,thandiwe_newton_embracing_otherness_embracing_myself,"Embracing otherness, embracing myself",Thandiwe Newton
555877,1085,jr_my_wish_use_art_to_turn_the_world_inside_out,My wish: Use art to turn the world inside out,JR
562982,121911,iseult_gillespie_the_largest_river_on_earth_is_actually_in_the_sky,The largest river on Earth is actually in the sky,Iseult Gillespie
562982,120091,carolyn_beans_does_planting_trees_actually_cool_the_planet,Does planting trees actually cool the planet?,Carolyn Beans
562982,109914,stephanie_honchell_smith_whatever_happened_to_the_hole_in_the_ozone_layer,Whatever happened to the hole in the ozone layer?,Stephanie Honchell Smith
562754,91528,john_c_mather_how_the_james_webb_space_telescope_will_unfold_the_universe,How the James Webb Space Telescope will unfold the universe,John C. Mather
562754,94637,chanda_prescod_weinstein_the_search_for_the_invisible_matter_that_shapes_the_universe,The search for the invisible matter that shapes the universe,Chanda Prescod-Weinstein
562754,136279,tejal_gala_are_you_more_likely_to_explode_or_freeze_in_space,Are you more likely to explode or freeze in space?,Tejal Gala
562754,224,roy_gould_curtis_wong_a_preview_of_the_worldwide_telescope,A preview of the WorldWide Telescope,Roy Gould + Curtis Wong
562754,23913,marjee_chmiel_and_trevor_owens_is_there_a_center_of_the_universe,Is there a center of the universe?,Marjee Chmiel and Trevor Owens
562754,2069,andrew_connolly_what_s_the_next_window_into_our_universe,What's the next window into our universe?,Andrew Connolly
561606,137252,brian_s_lowery_and_kylan_gibbs_what_makes_us_human_in_the_age_of_ai_a_psychologist_and_a_technologist_answer,What makes us human in the age of AI? A psychologist and a technologist answer,Brian S. Lowery and Kylan Gibbs
561606,24415,kostas_karpouzis_can_machines_read_your_emotions,Can machines read your emotions?,Kostas Karpouzis
561606,143156,eugenia_kuyda_can_ai_companions_help_heal_loneliness,Can AI companions help heal loneliness?,Eugenia Kuyda
561606,2841,tom_gruber_how_ai_can_enhance_our_memory_work_and_social_lives,"How AI can enhance our memory, work and social lives",Tom Gruber
561606,17851,max_tegmark_how_to_get_empowered_not_overpowered_by_ai,"How to get empowered, not overpowered, by AI",Max Tegmark
561606,2645,kevin_kelly_how_ai_can_bring_on_a_second_industrial_revolution,How AI can bring on a second Industrial Revolution,Kevin Kelly
556122,140233,stephanie_r_yates_anyabwile_your_relationship_expectations_could_be_holding_you_back,Your relationship expectations could be holding you back,Stephanie R. Yates-Anyabwile
556122,139886,teri_hofford_why_you_think_you_look_bad_in_photos,Why you think you look bad in photos,Teri Hofford
556122,114590,how_to_be_a_better_human_how_to_embrace_and_challenge_the_idea_of_beauty_w_elise_hu,"How to embrace – and challenge – the idea of ""beauty"" (w/ Elise Hu)",How to Be a Better Human
556122,1066,johanna_blakley_social_media_and_the_end_of_gender,Social media and the end of gender,Johanna Blakley
556122,575,clay_shirky_how_social_media_can_make_history,How social media can make history,Clay Shirky
556122,1201,adam_ostrow_after_your_final_status_update,After your final status update,Adam Ostrow
562853,141065,alex_amouyel_can_salad_dressing_transform_capitalism,Can salad dressing transform capitalism?,Alex Amouyel
562853,142742,amy_shoenthal_how_to_turn_setbacks_into_success,How to turn setbacks into success,Amy Shoenthal
562853,140439,raja_rajamannar_the_art_of_marketing_for_good,The art of marketing — for good,Raja Rajamannar
562853,1436,gary_kovacs_tracking_our_online_trackers,Tracking our online trackers,Gary Kovacs
562853,972,tim_jackson_an_economic_reality_check,An economic reality check,Tim Jackson
562853,1823,eric_berlow_and_sean_gourley_mapping_ideas_worth_spreading,Mapping ideas worth spreading,Eric Berlow and Sean Gourley
563056,121116,aviv_regev_can_ai_help_develop_new_medicines,Can AI help develop new medicines?,Aviv Regev
563056,141972,ted_health_a_healthier_you_a_5_step_guide_to_better_doctor_visits,A Healthier You: A 5-step guide to better doctor visits,TED Health
563056,12946,jan_denecker_how_to_do_more_with_less_in_healthcare,How to do more with less in healthcare,Jan Denecker
562391,38972,sajan_saini_the_hidden_network_that_makes_the_internet_possible,The hidden network that makes the internet possible,Sajan Saini
562391,43862,chiara_decaroli_the_high_stakes_race_to_make_quantum_computers_work,The high-stakes race to make quantum computers work,Chiara Decaroli
562391,96034,charles_wallace_and_sajan_saini_why_a_sausage_can_do_what_your_gloves_cannot,Why a sausage can do what your gloves cannot,Charles Wallace and Sajan Saini
554298,117720,natalie_cargill_how_to_solve_the_world_s_biggest_problems,How to solve the world's biggest problems,Natalie Cargill
554298,109967,rebecca_darwent_how_to_fund_real_change_in_your_community,How to fund real change in your community,Rebecca Darwent
554298,138368,karthik_muralidharan_why_spending_smarter_beats_bigger_budgets,Why spending smarter beats bigger budgets,Karthik Muralidharan
554298,1837,michael_porter_the_case_for_letting_business_solve_social_problems,The case for letting business solve social problems,Michael Porter
554298,1927,chris_mcknett_the_investment_logic_for_sustainability,The investment logic for sustainability,Chris McKnett
554298,1904,harish_manwani_profit_s_not_always_the_point,Profit’s not always the point,Harish Manwani
562004,143076,jenny_chase_solar_energy_is_even_cheaper_than_you_think,Solar energy is even cheaper than you think,Jenny Chase
562004,141067,danielle_butcher_franz_i_m_a_conservative_and_i_care_about_the_climate_too,"I’m a conservative — and I care about the climate, too",Danielle Butcher Franz
562004,138325,huiyi_lin_what_does_poverty_look_like_on_a_plate,What does poverty look like on a plate?,Huiyi Lin
562004,192,david_keith_a_critical_look_at_geoengineering_against_climate_change,A critical look at geoengineering against climate change,David Keith
562004,1380,james_hansen_why_i_must_speak_out_about_climate_change,Why I must speak out about climate change,James Hansen
562004,2339,alice_bows_larkin_climate_change_is_happening_here_s_how_we_adapt,Climate change is happening. Here's how we adapt,Alice Bows-Larkin
557132,24525,rusha_modi_the_surprising_cause_of_stomach_ulcers,The surprising cause of stomach ulcers,Rusha Modi
557132,141920,shannon_odell_do_you_really_need_to_take_10_000_steps_a_day,"Do you really need to take 10,000 steps a day?",Shannon Odell
557132,24228,tien_nguyen_how_do_pregnancy_tests_work,How do pregnancy tests work?,Tien Nguyen
562728,141239,max_jaderberg_how_ai_is_saving_billions_of_years_of_human_research_time,How AI is saving billions of years of human research time,Max Jaderberg
562728,140425,jennifer_golbeck_is_ai_progress_stuck,Is AI progress stuck?,Jennifer Golbeck
562728,131493,vinod_khosla_12_predictions_for_the_future_of_technology,12 predictions for the future of technology,Vinod Khosla
562728,2841,tom_gruber_how_ai_can_enhance_our_memory_work_and_social_lives,"How AI can enhance our memory, work and social lives",Tom Gruber
562728,17851,max_tegmark_how_to_get_empowered_not_overpowered_by_ai,"How to get empowered, not overpowered, by AI",Max Tegmark
562728,2645,kevin_kelly_how_ai_can_bring_on_a_second_industrial_revolution,How AI can bring on a second Industrial Revolution,Kevin Kelly
561914,140233,stephanie_r_yates_anyabwile_your_relationship_expectations_could_be_holding_you_back,Your relationship expectations could be holding you back,Stephanie R. Yates-Anyabwile
561914,135443,chris_duffy_how_to_find_laughter_anywhere,How to find laughter anywhere,Chris Duffy
561914,137456,reggie_watts_everything_is_improvisation_including_this_ted_talk,Everything is improvisation — including this TED Talk,Reggie Watts
561914,483,stuart_brown_play_is_more_than_just_fun,Play is more than just fun,Stuart Brown
561914,1170,steve_keil_a_manifesto_for_play_for_bulgaria_and_beyond,"A manifesto for play, for Bulgaria and beyond",Steve Keil
561914,392,tim_brown_tales_of_creativity_and_play,Tales of creativity and play,Tim Brown
561604,141561,chin_teng_lin_the_mind_reading_potential_of_ai,The mind-reading potential of AI,Chin-Teng Lin
561604,141557,cara_hunter_how_a_deepfake_almost_ruined_my_political_career,How a deepfake almost ruined my political career,Cara Hunter
561604,75585,gary_devore_run_sail_or_hide_how_to_survive_the_destruction_of_pompeii,"Run, sail or hide? How to survive the destruction of Pompeii",Gary Devore
561604,2841,tom_gruber_how_ai_can_enhance_our_memory_work_and_social_lives,"How AI can enhance our memory, work and social lives",Tom Gruber
561604,17851,max_tegmark_how_to_get_empowered_not_overpowered_by_ai,"How to get empowered, not overpowered, by AI",Max Tegmark
561604,2645,kevin_kelly_how_ai_can_bring_on_a_second_industrial_revolution,How AI can bring on a second Industrial Revolution,Kevin Kelly
554332,137405,kristine_mcdivitt_tompkins_a_bold_plan_to_rewild_the_earth_at_massive_scale,A bold plan to rewild the Earth — at massive scale ,Kristine McDivitt Tompkins
554332,136305,anjan_sundaram_meet_our_planet_s_hidden_defenders,Meet our planet's hidden defenders,Anjan Sundaram
554332,113386,george_t_whitesides_the_growing_megafire_crisis_and_how_to_contain_it,The growing megafire crisis — and how to contain it,George T. Whitesides
554332,243,al_gore_new_thinking_on_the_climate_crisis,New thinking on the climate crisis,Al Gore
554332,341,jonathan_haidt_the_moral_roots_of_liberals_and_conservatives,The moral roots of liberals and conservatives,Jonathan Haidt
554332,2784,ted_halstead_a_climate_solution_where_all_sides_can_win,A climate solution where all sides can win,Ted Halstead
556611,89582,elizabeth_carlen_and_joanna_moles_how_pigeons_took_over_the_world,How pigeons took over the world,Elizabeth Carlen and Joanna Moles
556611,30507,eva_maria_geigl_the_history_of_the_world_according_to_cats,The history of the world according to cats,Eva-Maria Geigl
556611,90453,ameya_gondhalekar_why_are_cockroaches_so_hard_to_kill,Why are cockroaches so hard to kill?,Ameya Gondhalekar
557559,141407,avani_prabhakar_how_distributed_work_can_unlock_your_potential,How distributed work can unlock your potential,Avani Prabhakar
557559,141410,simone_stolzoff_how_to_reclaim_your_life_from_work,How to reclaim your life from work,Simone Stolzoff
557559,140319,molly_graham_forget_the_corporate_ladder_winners_take_risks,Forget the corporate ladder — winners take risks,Molly Graham
557559,1930,roselinde_torres_what_it_takes_to_be_a_great_leader,What it takes to be a great leader,Roselinde Torres
557559,2099,susan_colantuono_the_career_advice_you_probably_didn_t_get,The career advice you probably didn’t get,Susan Colantuono
557559,1998,simon_sinek_why_good_leaders_make_you_feel_safe,Why good leaders make you feel safe,Simon Sinek
553124,123147,sylvester_chauke_what_if_advertising_was_honest,What if advertising was honest?,Sylvester Chauke
553124,115681,sandersan_onie_how_targeted_ads_might_just_save_your_life,How targeted ads might just save your life,Sandersan Onie
553124,121579,jessica_apotheker_what_will_happen_to_marketing_in_the_age_of_ai,What will happen to marketing in the age of AI?,Jessica Apotheker
553124,1837,michael_porter_the_case_for_letting_business_solve_social_problems,The case for letting business solve social problems,Michael Porter
553124,21307,leticia_gasca_don_t_fail_fast_fail_mindfully,Don't fail fast -- fail mindfully,Leticia Gasca
553124,1850,steve_howard_let_s_go_all_in_on_selling_sustainability,Let's go all-in on selling sustainability,Steve Howard
554978,138440,anne_morriss_unsolicited_advice_why_is_amazon_dragging_its_employees_back_into_the_office,Unsolicited Advice: Why is Amazon dragging its employees back into the office?,Anne Morriss
554978,141410,simone_stolzoff_how_to_reclaim_your_life_from_work,How to reclaim your life from work,Simone Stolzoff
554978,135442,zeynep_ton_the_case_for_good_jobs_and_why_they_re_good_for_business_too,The case for good jobs — and why they're good for business too,Zeynep Ton
554978,1930,roselinde_torres_what_it_takes_to_be_a_great_leader,What it takes to be a great leader,Roselinde Torres
554978,3585,rocio_lorenzo_how_diversity_makes_teams_more_innovative,How diversity makes teams more innovative,Rocío Lorenzo
554978,1591,tim_leberecht_3_ways_to_usefully_lose_control_of_your_brand,3 ways to (usefully) lose control of your brand,Tim Leberecht
558004,77709,susan_m_reverby_ugly_history_the_us_syphilis_experiment,Ugly History: The US syphilis experiment,Susan M. Reverby
558004,61575,anees_bahji_what_is_schizophrenia,What is schizophrenia?,Anees Bahji
558004,29998,helen_m_farrell_the_truth_about_electroconvulsive_therapy_ect,The truth about electroconvulsive therapy (ECT),Helen M. Farrell
547107,138323,norah_magero_this_refrigerator_is_saving_lives,This refrigerator is saving lives ,Norah Magero
547107,138319,joel_bervell_a_medical_mythbuster_s_mission_to_improve_health_care,A medical mythbuster's mission to improve health care,Joel Bervell
547107,138328,paule_joseph_why_smell_matters_more_than_you_think,Why smell matters more than you think,Paule Joseph
547107,1711,eric_dishman_health_care_should_be_a_team_sport,Health care should be a team sport,Eric Dishman
547107,1475,rebecca_onie_what_if_our_health_care_system_kept_us_healthy,What if our health care system kept us healthy?,Rebecca Onie
547107,2076,rishi_manchanda_what_makes_us_get_sick_look_upstream,What makes us get sick? Look upstream,Rishi Manchanda
558052,112486,shannon_odell_should_you_switch_to_solar,Should you switch to solar?,Shannon Odell
558052,112606,ali_hajimiri_how_wireless_energy_from_space_could_power_everything,How wireless energy from space could power everything,Ali Hajimiri
558052,117489,rebecca_collyer_how_to_supercharge_renewables_and_energize_the_world,How to supercharge renewables and energize the world,Rebecca Collyer
