id,related_id,slug,title,presenterDisplayName
534463,52807,laurel_braitman_the_mental_health_benefits_of_storytelling_for_health_care_workers,The mental health benefits of storytelling for health care workers,Laurel Braitman
534463,111749,alua_arthur_why_thinking_about_death_helps_you_live_a_better_life,Why thinking about death helps you live a better life,Alua Arthur
534463,78168,david_kessler_how_to_find_meaning_after_loss,How to find meaning after loss,David Kessler
534463,9463,susan_david_the_gift_and_power_of_emotional_courage,The gift and power of emotional courage,Susan David
534463,7592,tiffany_watt_smith_the_history_of_human_emotions,The history of human emotions,Tiffany Watt Smith
534463,2279,rana_el_kaliouby_this_app_knows_how_you_feel_from_the_look_on_your_face,This app knows how you feel -- from the look on your face,Rana el Kaliouby
537328,132784,uma_valeti_is_cultivated_meat_the_future_of_food,Is cultivated meat the future of food?,Uma Valeti
537328,133290,dorcas_naishorua_lessons_from_people_already_adapting_to_the_climate_crisis,Lessons from people already adapting to the climate crisis,Dorcas Naishorua
537328,133189,david_friedberg_a_scientific_breakthrough_that_could_transform_how_we_produce_food,A scientific breakthrough that could transform how we produce food,David Friedberg
537328,1412,jonathan_foley_the_other_inconvenient_truth,The other inconvenient truth,Jonathan Foley
537328,1565,tristram_stuart_the_global_food_waste_scandal,The global food waste scandal,Tristram Stuart
537328,1199,josette_sheeran_ending_hunger_now,Ending hunger now,Josette Sheeran
536268,133618,geena_rocero_ted_talks_daily_book_club_horse_barbie,TED Talks Daily Book Club: Horse Barbie,Geena Rocero
536268,94635,how_to_be_a_better_human_how_to_unite_people_through_art_with_jr,How to unite people through art (with JR),How to Be a Better Human
536268,124005,ian_bremmer_the_us_vs_itself_and_other_top_global_risks_in_2024,The US vs. itself — and other top global risks in 2024,Ian Bremmer
537437,19831,beck_brachman_a_new_class_of_drug_that_could_prevent_depression_and_ptsd,A new class of drug that could prevent depression and PTSD,Beck Brachman
537437,95711,sergiu_p_pasca_how_we_re_reverse_engineering_the_human_brain_in_the_lab,How we're reverse engineering the human brain in the lab,Sergiu P. Pasca
537437,127365,jen_walsh_can_cannabis_help_you_sleep_here_s_the_science,Can cannabis help you sleep? Here's the science,Jen Walsh
537437,1557,vikram_patel_mental_health_for_all_by_involving_all,Mental health for all by involving all,Vikram Patel
537437,2739,sangu_delle_there_s_no_shame_in_taking_care_of_your_mental_health,There's no shame in taking care of your mental health,Sangu Delle
537437,24286,helen_m_farrell_what_is_depression,What is depression?,Helen M. Farrell
527008,125754,mahogany_n_motion_the_drumline_meets_the_danceline,The drumline meets the danceline, Mahogany-N-Motion
527008,132680,niaz_nawab_ye_pariye_naz_simorgh_darya,"""Ye Pariye Naz"" / ""Simorgh"" / ""Darya""",Niaz Nawab
527008,127479,tunde_olaniran_music_movement_and_poetry,"Music, movement and poetry",Tunde Olaniran
527008,1526,mark_applebaum_the_mad_scientist_of_music,The mad scientist of music,Mark Applebaum
527008,1440,michael_tilson_thomas_music_and_emotion_through_time,Music and emotion through time,Michael Tilson Thomas
527008,883,david_byrne_how_architecture_helped_music_evolve,How architecture helped music evolve,David Byrne
536538,8155,david_kwong_the_science_of_illusion,The science of illusion,David Kwong
536538,112998,lonneke_gordijn_nature_art_and_magical_blocks_of_flying_concrete,"Nature, art and magical blocks of flying concrete",Lonneke Gordijn
536538,129163,demis_hassabis_how_ai_is_unlocking_the_secrets_of_nature_and_the_universe,How AI is unlocking the secrets of nature and the universe,Demis Hassabis
536538,2841,tom_gruber_how_ai_can_enhance_our_memory_work_and_social_lives,"How AI can enhance our memory, work and social lives",Tom Gruber
536538,17851,max_tegmark_how_to_get_empowered_not_overpowered_by_ai,"How to get empowered, not overpowered, by AI",Max Tegmark
536538,10360,margaret_mitchell_how_we_can_build_ai_to_help_humans_not_hurt_us,"How we can build AI to help humans, not hurt us",Margaret Mitchell
533135,66924,ted_ed_the_surprising_effects_of_pregnancy,The surprising effects of pregnancy,TED-Ed
533135,2757,nassim_assefi_and_brian_a_levine_how_in_vitro_fertilization_ivf_works,How in vitro fertilization (IVF) works,Nassim Assefi and Brian A. Levine
533135,24387,nwhunter_how_do_contraceptives_work,How do contraceptives work?,NWHunter
528910,126805,ian_bassin_how_to_spot_authoritarianism_and_choose_democracy,How to spot authoritarianism — and choose democracy,Ian Bassin
528910,122557,sofia_ongele_your_creative_superpowers_can_help_protect_democracy,Your creative superpowers can help protect democracy,Sofia Ongele
528910,129699,andrew_yang_why_us_politics_is_broken_and_how_to_fix_it,Why US politics is broken — and how to fix it,Andrew Yang
528910,1765,george_papandreou_imagine_a_european_democracy_without_borders,Imagine a European democracy without borders,George Papandreou
528910,1547,ivan_krastev_can_democracy_exist_without_trust,Can democracy exist without trust?,Ivan Krastev
528910,1595,rory_stewart_why_democracy_matters,Why democracy matters,Rory Stewart
535458,3280,huang_yi_kuka_a_human_robot_dance_duet,A human-robot dance duet,Huang Yi & KUKA
535458,130471,fei_fei_li_with_spatial_intelligence_ai_will_understand_the_real_world,"With spatial intelligence, AI will understand the real world",Fei-Fei Li
535458,127267,ken_goldberg_why_don_t_we_have_better_robots_yet,Why don't we have better robots yet?,Ken Goldberg
535458,355,rodney_brooks_robots_will_invade_our_lives,Robots will invade our lives,Rodney Brooks
535458,1709,keller_rinaudo_cliffton_a_mini_robot_powered_by_your_phone,A mini robot -- powered by your phone,Keller Rinaudo Cliffton
535458,1070,cynthia_breazeal_the_rise_of_personal_robots,The rise of personal robots,Cynthia Breazeal
536152,1961,geena_rocero_why_i_must_come_out,Why I must come out,Geena Rocero
536152,126251,how_to_be_a_better_human_alok_is_microdosing_creativity_and_rejecting_norms,ALOK is microdosing creativity and rejecting norms,How to Be a Better Human
536152,131781,design_matters_with_debbie_millman_carrie_brownstein,Carrie Brownstein,Design Matters with Debbie Millman
535020,132784,uma_valeti_is_cultivated_meat_the_future_of_food,Is cultivated meat the future of food?,Uma Valeti
535020,128250,wan_faridah_akmal_jusoh_the_luminous_mystery_of_fireflies,The luminous mystery of fireflies,Wan Faridah Akmal Jusoh
535020,115476,wanjira_mathai_the_tree_growing_movement_restoring_africa_s_vital_landscapes,The tree-growing movement restoring Africa's vital landscapes,Wanjira Mathai
535020,192,david_keith_a_critical_look_at_geoengineering_against_climate_change,A critical look at geoengineering against climate change,David Keith
535020,2784,ted_halstead_a_climate_solution_where_all_sides_can_win,A climate solution where all sides can win,Ted Halstead
535020,243,al_gore_new_thinking_on_the_climate_crisis,New thinking on the climate crisis,Al Gore
531668,112486,shannon_odell_should_you_switch_to_solar,Should you switch to solar?,Shannon Odell
531668,126508,shannon_odell_what_earth_in_2050_could_look_like,What Earth in 2050 could look like,Shannon Odell
531668,115659,george_zaidan_why_your_phone_battery_gets_worse_over_time,Why your phone battery gets worse over time,George Zaidan
534909,130850,storybook_maze_a_street_librarian_s_quest_to_bring_books_to_everyone,A street librarian's quest to bring books to everyone,Storybook Maze
534909,123146,newsha_ghaeli_the_vital_data_you_flush_down_the_toilet,The vital data you flush down the toilet,Newsha Ghaeli
534909,128249,randy_seriguchi_jr_the_us_has_a_teacher_shortage_here_s_how_to_fix_it,The US has a teacher shortage — here's how to fix it,Randy Seriguchi Jr.
534909,1843,jeff_speck_the_walkable_city,The walkable city,Jeff Speck
534909,1966,amanda_burden_how_public_spaces_make_cities_work,How public spaces make cities work,Amanda Burden
534909,1865,mick_cornett_how_an_obese_town_lost_a_million_pounds,How an obese town lost a million pounds,Mick Cornett
533846,131493,vinod_khosla_12_predictions_for_the_future_of_technology,12 predictions for the future of technology,Vinod Khosla
533846,2015,ray_kurzweil_get_ready_for_hybrid_thinking,Get ready for hybrid thinking,Ray Kurzweil
533846,119531,ruha_benjamin_is_technology_our_savior_or_our_slayer, Is technology our savior — or our slayer?,Ruha Benjamin
533846,2841,tom_gruber_how_ai_can_enhance_our_memory_work_and_social_lives,"How AI can enhance our memory, work and social lives",Tom Gruber
533846,17851,max_tegmark_how_to_get_empowered_not_overpowered_by_ai,"How to get empowered, not overpowered, by AI",Max Tegmark
533846,2645,kevin_kelly_how_ai_can_bring_on_a_second_industrial_revolution,How AI can bring on a second Industrial Revolution,Kevin Kelly
532021,53671,hyunsoo_joshua_no_how_does_chemotherapy_work,How does chemotherapy work?,Hyunsoo Joshua No
532021,54513,tal_danino_hacking_bacteria_to_fight_cancer,Hacking bacteria to fight cancer,Tal Danino
532021,23794,george_zaidan_and_charles_morton_how_do_cancer_cells_behave_differently_from_healthy_ones,How do cancer cells behave differently from healthy ones?,George Zaidan and Charles Morton
534082,120982,eric_topol_can_ai_catch_what_doctors_miss,Can AI catch what doctors miss?,Eric Topol
534082,95711,sergiu_p_pasca_how_we_re_reverse_engineering_the_human_brain_in_the_lab,How we're reverse engineering the human brain in the lab,Sergiu P. Pasca
534082,28050,nita_farahany_when_technology_can_read_minds_how_will_we_protect_our_privacy,"When technology can read minds, how will we protect our privacy?",Nita Farahany
534082,355,rodney_brooks_robots_will_invade_our_lives,Robots will invade our lives,Rodney Brooks
534082,1070,cynthia_breazeal_the_rise_of_personal_robots,The rise of personal robots,Cynthia Breazeal
534082,1709,keller_rinaudo_cliffton_a_mini_robot_powered_by_your_phone,A mini robot -- powered by your phone,Keller Rinaudo Cliffton
530824,27750,dawn_wacek_a_librarian_s_case_against_overdue_book_fines,A librarian's case against overdue book fines,Dawn Wacek
530824,21701,elizabeth_cox_what_really_happened_to_the_library_of_alexandria,What really happened to the Library of Alexandria?,Elizabeth Cox
530824,128351,chezare_a_warren_the_difference_between_false_empathy_and_true_support,The difference between false empathy and true support,Chezare A. Warren
530824,346,brewster_kahle_a_free_digital_library,A free digital library,Brewster Kahle
530824,24414,chand_john_what_s_the_fastest_way_to_alphabetize_your_bookshelf,What's the fastest way to alphabetize your bookshelf?,Chand John
530824,1410,chip_kidd_designing_books_is_no_laughing_matter_ok_it_is,"Designing books is no laughing matter. OK, it is.",Chip Kidd
534911,132784,uma_valeti_is_cultivated_meat_the_future_of_food,Is cultivated meat the future of food?,Uma Valeti
534911,127861,louise_mabulo_a_climate_solution_the_wisdom_passed_down_through_generations,A climate solution? The wisdom passed down through generations,Louise Mabulo
534911,119204,jim_whitaker_and_jessica_whitaker_allen_a_cleaner_world_could_start_in_a_rice_field,A cleaner world could start in a rice field,Jim Whitaker and Jessica Whitaker Allen
534911,1565,tristram_stuart_the_global_food_waste_scandal,The global food waste scandal,Tristram Stuart
534911,263,mark_bittman_what_s_wrong_with_what_we_eat,What's wrong with what we eat,Mark Bittman
534911,1199,josette_sheeran_ending_hunger_now,Ending hunger now,Josette Sheeran
533754,81212,martin_hilpert_what_makes_a_language_a_language,What makes a language... a language?,Martin Hilpert
533754,95588,ilan_stavans_a_brief_history_of_spanish, A brief history of Spanish,Ilan Stavans
533754,126098,franziska_naether_why_was_the_rosetta_stone_so_important,Why was the Rosetta Stone so important?,Franziska Naether
534120,82095,isha_datar_how_we_could_eat_real_meat_without_harming_animals,How we could eat real meat without harming animals,Isha Datar
534120,130929,aruna_rangachar_pohl_a_snack_s_journey_from_the_farm_to_your_mouth,A snack's journey from the farm to your mouth,Aruna Rangachar Pohl
534120,116754,carolyn_beans_is_plant_based_meat_actually_better_for_you,Is plant-based meat actually better for you?,Carolyn Beans
534120,263,mark_bittman_what_s_wrong_with_what_we_eat,What's wrong with what we eat,Mark Bittman
534120,860,graham_hill_why_i_m_a_weekday_vegetarian,Why I'm a weekday vegetarian,Graham Hill
534120,1565,tristram_stuart_the_global_food_waste_scandal,The global food waste scandal,Tristram Stuart
532915,131534,julie_and_john_gottman_even_healthy_couples_fight_the_difference_is_how,Even healthy couples fight — the difference is how,Julie and John Gottman
532915,111749,alua_arthur_why_thinking_about_death_helps_you_live_a_better_life,Why thinking about death helps you live a better life,Alua Arthur
532915,1378,bryan_stevenson_we_need_to_talk_about_an_injustice,We need to talk about an injustice,Bryan Stevenson
532915,570,nancy_etcoff_happiness_and_its_surprises,Happiness and its surprises,Nancy Etcoff
532915,1607,matt_killingsworth_want_to_be_happier_stay_in_the_moment,Want to be happier? Stay in the moment,Matt Killingsworth
532915,1036,rufus_griscom_alisa_volkman_let_s_talk_parenting_taboos,Let's talk parenting taboos,Rufus Griscom + Alisa Volkman
533750,77552,mark_robinson_a_day_in_the_life_of_the_oracle_of_delphi,A day in the life of the Oracle of Delphi,Mark Robinson
533750,44345,iseult_gillespie_why_should_you_read_hamlet,"Why should you read ""Hamlet""?",Iseult Gillespie
533750,77043,soraya_field_fiorio_the_epic_of_gilgamesh_the_king_who_tried_to_conquer_death,"The epic of Gilgamesh, the king who tried to conquer death",Soraya Field Fiorio
533961,80686,adam_grant_how_to_stop_languishing_and_start_finding_flow,How to stop languishing and start finding flow,Adam Grant
533961,122058,rosita_najmi_what_s_your_leadership_language,What's your leadership language?,Rosita Najmi
533961,131492,adrienne_maree_brown_and_baratunde_thurston_how_to_imagine_a_better_future_for_democracy,How to imagine a better future for democracy,adrienne maree brown and Baratunde Thurston
533961,1930,roselinde_torres_what_it_takes_to_be_a_great_leader,What it takes to be a great leader,Roselinde Torres
533961,1765,george_papandreou_imagine_a_european_democracy_without_borders,Imagine a European democracy without borders,George Papandreou
533961,156,patrick_awuah_how_to_educate_leaders_liberal_arts,How to educate leaders? Liberal arts,Patrick Awuah
522396,131492,adrienne_maree_brown_and_baratunde_thurston_how_to_imagine_a_better_future_for_democracy,How to imagine a better future for democracy,adrienne maree brown and Baratunde Thurston
522396,126792,fatma_karume_how_to_fight_for_democracy_in_the_shadow_of_autocracy,How to fight for democracy in the shadow of autocracy,Fatma Karume
522396,129699,andrew_yang_why_us_politics_is_broken_and_how_to_fix_it,Why US politics is broken — and how to fix it,Andrew Yang
522396,1765,george_papandreou_imagine_a_european_democracy_without_borders,Imagine a European democracy without borders,George Papandreou
522396,1595,rory_stewart_why_democracy_matters,Why democracy matters,Rory Stewart
522396,1547,ivan_krastev_can_democracy_exist_without_trust,Can democracy exist without trust?,Ivan Krastev
533249,130929,aruna_rangachar_pohl_a_snack_s_journey_from_the_farm_to_your_mouth,A snack's journey from the farm to your mouth,Aruna Rangachar Pohl
533249,103914,vincent_yeow_lim_the_nostalgia_behind_your_favorite_chinese_food,The nostalgia behind your favorite Chinese food,Vincent Yeow Lim
533249,119204,jim_whitaker_and_jessica_whitaker_allen_a_cleaner_world_could_start_in_a_rice_field,A cleaner world could start in a rice field,Jim Whitaker and Jessica Whitaker Allen
533249,1565,tristram_stuart_the_global_food_waste_scandal,The global food waste scandal,Tristram Stuart
533249,1304,homaro_cantu_ben_roche_cooking_as_alchemy,Cooking as alchemy,Homaro Cantu + Ben Roche
533249,263,mark_bittman_what_s_wrong_with_what_we_eat,What's wrong with what we eat,Mark Bittman
532483,128622,fixable_unsolicited_advice_boeing_how_to_lead_in_a_crisis,Unsolicited Advice: Boeing & how to lead in a crisis,Fixable
532483,125901,fixable_how_to_outsmart_bias_at_work,How to outsmart bias at work,Fixable
533959,126449,leili_anvar_a_meditation_on_rumi_and_the_power_of_poetry,A meditation on Rumi and the power of poetry,Leili Anvar
533959,119256,benjamin_zander_life_lessons_from_beethoven_s_symphony_no_9,Life lessons from Beethoven's Symphony No. 9,Benjamin Zander
533959,101419,bedouine_nice_and_quiet_one_of_these_days,"""Nice and Quiet"" / ""One Of These Days""",Bedouine
533959,35945,crush_club_my_man_bohanna_we_dance,"""My Man"" / ""Bohanna"" / ""We Dance""", Crush Club
533959,1994,mark_ronson_how_sampling_transformed_music,How sampling transformed music,Mark Ronson
533959,883,david_byrne_how_architecture_helped_music_evolve,How architecture helped music evolve,David Byrne
532957,131384,tessa_west_the_problem_with_being_too_nice_at_work_sep_2024,"The problem with being ""too nice"" at work",Tessa West
532957,77144,emily_nagoski_and_amelia_nagoski_the_cure_for_burnout_hint_it_isn_t_self_care,The cure for burnout (hint: it isn't self-care),Emily Nagoski and Amelia Nagoski
532957,109966,azim_shariff_does_working_hard_really_make_you_a_good_person,Does working hard really make you a good person?,Azim Shariff
532957,24286,helen_m_farrell_what_is_depression,What is depression?,Helen M. Farrell
532957,1830,kevin_breel_confessions_of_a_depressed_comic,Confessions of a depressed comic,Kevin Breel
532957,2889,nikki_webber_allen_don_t_suffer_from_your_depression_in_silence,Don't suffer from your depression in silence,Nikki Webber Allen
526166,72185,amanda_gorman_using_your_voice_is_a_political_choice,Using your voice is a political choice,Amanda Gorman
526166,128351,chezare_a_warren_the_difference_between_false_empathy_and_true_support,The difference between false empathy and true support,Chezare A. Warren
526166,128187,bea_rodriguez_fransen_unlocking_indigenous_knowledge_a_new_path_for_education,Unlocking Indigenous knowledge: A new path for education,Bea Rodriguez-Fransen
528476,119370,alex_rosenthal_can_you_solve_the_secret_assassin_society_riddle,Can you solve the secret assassin society riddle?,Alex Rosenthal
528476,110503,dan_finkel_can_you_outsmart_fate_and_break_her_ancient_curse,Can you outsmart Fate and break her ancient curse?,Dan Finkel
528476,24381,dan_van_der_vieren_how_the_konigsberg_bridge_problem_changed_mathematics,How the Königsberg bridge problem changed mathematics,Dan Van der Vieren
533387,131494,rumman_chowdhury_your_right_to_repair_ai_systems,Your right to repair AI systems,Rumman Chowdhury
533387,131493,vinod_khosla_12_predictions_for_the_future_of_technology,12 predictions for the future of technology,Vinod Khosla
533387,129460,helen_toner_how_to_govern_ai_even_if_it_s_hard_to_predict,How to govern AI — even if it's hard to predict,Helen Toner
533387,2841,tom_gruber_how_ai_can_enhance_our_memory_work_and_social_lives,"How AI can enhance our memory, work and social lives",Tom Gruber
533387,17851,max_tegmark_how_to_get_empowered_not_overpowered_by_ai,"How to get empowered, not overpowered, by AI",Max Tegmark
533387,2645,kevin_kelly_how_ai_can_bring_on_a_second_industrial_revolution,How AI can bring on a second Industrial Revolution,Kevin Kelly
531432,87042,thomas_w_cronin_which_animal_has_the_best_eyesight,Which animal has the best eyesight?,Thomas W. Cronin
531432,75294,justin_schmidt_the_world_s_most_painful_insect_sting,The world's most painful insect sting,Justin Schmidt
531432,116457,carly_anne_york_why_were_scientists_so_obsessed_with_these_frogs,Why were scientists so obsessed with these frogs?,Carly Anne York
532157,127674,george_blair_west_is_your_partner_the_one_wrong_question,"Is your partner ""the one?"" Wrong question",George Blair-West
532157,132054,yoram_yovell_why_broken_hearts_hurt_and_what_heals_them,Why broken hearts hurt — and what heals them,Yoram Yovell
532157,127715,maria_sophocles_what_happens_to_sex_in_midlife_a_look_at_the_bedroom_gap,"What happens to sex in midlife? A look at the ""bedroom gap""",Maria Sophocles
532157,1597,david_pizarro_the_strange_politics_of_disgust,The strange politics of disgust,David Pizarro
532157,9463,susan_david_the_gift_and_power_of_emotional_courage,The gift and power of emotional courage,Susan David
532157,1094,david_brooks_the_social_animal,The social animal,David Brooks
532913,127050,amber_cabral_3_steps_to_better_connect_with_your_fellow_humans,3 steps to better connect with your fellow humans,Amber Cabral
532913,131384,tessa_west_the_problem_with_being_too_nice_at_work_sep_2024,"The problem with being ""too nice"" at work",Tessa West
532913,130848,martin_gutmann_are_we_celebrating_the_wrong_leaders,Are we celebrating the wrong leaders?,Martin Gutmann
532913,1930,roselinde_torres_what_it_takes_to_be_a_great_leader,What it takes to be a great leader,Roselinde Torres
532913,3585,rocio_lorenzo_how_diversity_makes_teams_more_innovative,How diversity makes teams more innovative,Rocío Lorenzo
532913,2099,susan_colantuono_the_career_advice_you_probably_didn_t_get,The career advice you probably didn’t get,Susan Colantuono
532917,100915,shannon_odell_the_science_of_falling_in_love,The science of falling in love,Shannon Odell
532917,116453,amy_baxter_how_to_hack_your_brain_when_you_re_in_pain,How to hack your brain when you're in pain,Amy Baxter
532917,120759,kevin_h_gary_why_you_shouldn_t_trust_boredom,Why you shouldn't trust boredom,Kevin H. Gary
532917,24076,karen_d_davis_how_does_your_brain_respond_to_pain,How does your brain respond to pain?,Karen D. Davis
532917,2739,sangu_delle_there_s_no_shame_in_taking_care_of_your_mental_health,There's no shame in taking care of your mental health,Sangu Delle
532917,1633,molly_crockett_beware_neuro_bunk,Beware neuro-bunk,Molly Crockett
532481,87411,design_matters_with_debbie_millman_nick_offerman,Nick Offerman,Design Matters with Debbie Millman
532481,88606,design_matters_with_debbie_millman_the_evolution_of_marriage_with_esther_perel,The evolution of marriage with Esther Perel,Design Matters with Debbie Millman
532481,116356,design_matters_with_debbie_millman_design_matters_megan_rapinoe,Design Matters: Megan Rapinoe,Design Matters with Debbie Millman
532326,37985,tim_seibles_first_kiss,"""First Kiss""",Tim Seibles
532326,104428,birte_kristiansen_and_petra_sijpesteijn_a_day_in_the_life_of_a_teenager_in_medieval_baghdad,A day in the life of a teenager in medieval Baghdad,Birte Kristiansen and Petra Sijpesteijn
532326,66642,nina_medvinskaya_is_life_meaningless_and_other_absurd_questions,Is life meaningless? And other absurd questions,Nina Medvinskaya
532070,129391,pete_stavros_the_secret_ingredient_of_business_success,The secret ingredient of business success,Pete Stavros
532070,117218,mar_hershenson_the_secret_to_successfully_pitching_an_idea,The secret to successfully pitching an idea,Mar Hershenson
532070,97794,majora_carter_you_don_t_have_to_leave_your_neighborhood_to_live_in_a_better_one,You don't have to leave your neighborhood to live in a better one,Majora Carter
532070,23421,ashwini_anburajan_how_cryptocurrency_can_help_start_ups_get_investment_capital,How cryptocurrency can help start-ups get investment capital,Ashwini Anburajan
532070,983,jessica_jackley_poverty_money_and_love,"Poverty, money -- and love",Jessica Jackley
532070,1339,gayle_tzemach_lemmon_women_entrepreneurs_example_not_exception,"Women entrepreneurs, example not exception",Gayle Tzemach Lemmon
530954,119204,jim_whitaker_and_jessica_whitaker_allen_a_cleaner_world_could_start_in_a_rice_field,A cleaner world could start in a rice field,Jim Whitaker and Jessica Whitaker Allen
530954,118669,asmeret_asefaw_berhe_we_actually_have_a_shot_at_stopping_the_climate_crisis,We actually have a shot at stopping the climate crisis,Asmeret Asefaw Berhe
530954,94615,jane_zelikova_the_hidden_wonders_of_soil,The hidden wonders of soil,Jane Zelikova
530954,1412,jonathan_foley_the_other_inconvenient_truth,The other inconvenient truth,Jonathan Foley
530954,1016,birke_baehr_what_s_wrong_with_our_food_system,What's wrong with our food system,Birke Baehr
530954,46536,mohammad_modarres_why_you_should_shop_at_your_local_farmers_market,Why you should shop at your local farmers market,Mohammad Modarres
533087,1308,antonio_damasio_the_quest_to_understand_consciousness,The quest to understand consciousness,Antonio Damasio
533087,591,tom_wujec_3_ways_the_brain_creates_meaning,3 ways the brain creates meaning,Tom Wujec
533087,1309,sheila_nirenberg_a_prosthetic_eye_to_treat_blindness,A prosthetic eye to treat blindness,Sheila Nirenberg
533087,659,henry_markram_a_brain_in_a_supercomputer,A brain in a supercomputer,Henry Markram
533087,33799,michael_s_a_graziano_what_is_consciousness,What is consciousness?,Michael S. A. Graziano
533087,967,sebastian_seung_i_am_my_connectome,I am my connectome,Sebastian Seung
532005,97714,rebecca_l_walker_ethical_dilemma_whose_life_is_more_valuable,Ethical dilemma: Whose life is more valuable?,Rebecca L. Walker
532005,92474,roni_shanoada_how_does_heart_transplant_surgery_work,How does heart transplant surgery work?,Roni Shanoada
532005,77709,susan_m_reverby_ugly_history_the_us_syphilis_experiment,Ugly History: The US syphilis experiment,Susan M. Reverby
532068,130300,thomas_dohmke_with_ai_anyone_can_be_a_coder_now,"With AI, anyone can be a coder now",Thomas Dohmke
532068,129460,helen_toner_how_to_govern_ai_even_if_it_s_hard_to_predict,How to govern AI — even if it's hard to predict,Helen Toner
532068,129248,mustafa_suleyman_what_is_an_ai_anyway,What is an AI anyway?,Mustafa Suleyman
