id,related_id,slug,title,presenterDisplayName
597556,71355,moriba_jah_what_if_every_satellite_suddenly_disappeared,What if every satellite suddenly disappeared?,Moriba Jah
597556,81368,zoe_pierrat_earth_s_mysterious_red_glow_explained,"Earth's mysterious red glow, explained",Zoe Pierrat
597556,133908,shannon_odell_why_are_scientists_shooting_mushrooms_into_space,Why are scientists shooting mushrooms into space?,Shannon Odell
598761,160076,amy_barnes_will_climate_change_make_your_home_uninsurable,Will climate change make your home uninsurable?,Amy Barnes
598761,98643,ted_ed_is_capitalism_actually_broken,Is capitalism actually broken?, TED-Ed
598761,157429,jacqueline_novogratz_700_million_people_still_live_without_electricity_here_s_how_to_fix_that,700 million people still live without electricity. Here’s how to fix that,Jacqueline Novogratz
598761,192,david_keith_a_critical_look_at_geoengineering_against_climate_change,A critical look at geoengineering against climate change,David Keith
598761,243,al_gore_new_thinking_on_the_climate_crisis,New thinking on the climate crisis,Al Gore
598761,1380,james_hansen_why_i_must_speak_out_about_climate_change,Why I must speak out about climate change,James Hansen
597554,72493,arinjay_banerjee_why_bats_don_t_get_sick,Why bats don't get sick,Arinjay Banerjee
597554,23994,michael_molina_vampires_folklore_fantasy_and_fact,"Vampires: Folklore, fantasy, and fact",Michael Molina
597554,46518,ben_longdon_how_do_viruses_jump_from_animals_to_humans,How do viruses jump from animals to humans?,Ben Longdon
581925,148362,pinky_cole_how_i_make_vegan_food_sexy,How I make vegan food sexy,Pinky Cole
581925,158573,jenny_du_the_science_of_making_fruits_and_veggies_last_longer,The science of making fruits and veggies last longer,Jenny Du
581925,159493,carolyn_beans_what_are_truffles_and_why_are_they_so_expensive,"What are truffles, and why are they so expensive?",Carolyn Beans
581925,1304,homaro_cantu_ben_roche_cooking_as_alchemy,Cooking as alchemy,Homaro Cantu + Ben Roche
581925,207,paola_antonelli_treat_design_as_art,Treat design as art,Paola Antonelli
581925,1184,nathan_myhrvold_cooking_as_never_seen_before,Cooking as never seen before,Nathan Myhrvold
597955,161150,paul_triple_h_levesque_patrick_talty_inside_wwe_s_storytelling_machine,Inside WWE's storytelling machine,"Paul ""Triple H"" Levesque, Patrick Talty"
597955,147981,taylor_lynn_carpenter_parkour_how_the_sport_keeps_your_body_and_mind_fit,Parkour! How the sport keeps your body and mind fit,Taylor Lynn Carpenter
597955,135722,allyson_felix_the_olympic_spirit_and_how_you_can_tap_into_it,The Olympic spirit — and how you can tap into it,Allyson Felix
597955,1066,johanna_blakley_social_media_and_the_end_of_gender,Social media and the end of gender,Johanna Blakley
597955,1918,esta_soler_how_we_turned_the_tide_on_domestic_violence_hint_the_polaroid_helped,How we turned the tide on domestic violence (Hint: the Polaroid helped),Esta Soler
597955,1191,nadia_al_sakkaf_see_yemen_through_my_eyes,See Yemen through my eyes,Nadia Al-Sakkaf
596968,158681,dion_dawson_your_zip_code_shouldn_t_determine_your_lifespan,Your zip code shouldn’t determine your lifespan,Dion Dawson
596968,158679,molly_hemstreet_a_bold_idea_to_rebuild_the_working_class,A bold idea to rebuild the working class,Molly Hemstreet
596968,138326,mohamed_aburawi_a_hospital_in_the_cloud_bringing_health_care_anywhere_in_the_world,A hospital in the cloud bringing health care anywhere in the world,Mohamed Aburawi
596968,170,jeff_skoll_my_journey_into_movies_that_matter,My journey into movies that matter,Jeff Skoll
596968,403,franco_sacchi_a_tour_of_nollywood_nigeria_s_booming_film_industry,"A tour of Nollywood, Nigeria's booming film industry",Franco Sacchi
596968,561,yann_arthus_bertrand_a_wide_angle_view_of_fragile_earth,A wide-angle view of fragile Earth,Yann Arthus-Bertrand
594330,119530,john_o_donnell_can_a_simple_brick_be_the_next_great_battery,Can a simple brick be the next great battery?,John O'Donnell
594330,159494,mfikeyi_makayi_the_emerging_science_of_finding_critical_metals,The emerging science of finding critical metals ,Mfikeyi Makayi
594330,73540,ted_ed_the_material_that_could_change_the_world_for_a_third_time,The material that could change the world ... for a third time, TED-Ed
594330,192,david_keith_a_critical_look_at_geoengineering_against_climate_change,A critical look at geoengineering against climate change,David Keith
594330,1380,james_hansen_why_i_must_speak_out_about_climate_change,Why I must speak out about climate change,James Hansen
594330,243,al_gore_new_thinking_on_the_climate_crisis,New thinking on the climate crisis,Al Gore
596973,78380,robert_a_belle_the_emotions_behind_your_money_habits,The emotions behind your money habits,Robert A. Belle
596973,158458,nidhi_upadhyaya_how_we_got_hooked_on_credit_cards,How we got hooked on credit cards,Nidhi Upadhyaya
596973,131495,freada_kapor_klein_how_to_use_venture_capital_for_good,How to use venture capital for good,Freada Kapor Klein
596973,1607,matt_killingsworth_want_to_be_happier_stay_in_the_moment,Want to be happier? Stay in the moment,Matt Killingsworth
596973,570,nancy_etcoff_happiness_and_its_surprises,Happiness and its surprises,Nancy Etcoff
596973,779,daniel_kahneman_the_riddle_of_experience_vs_memory,The riddle of experience vs. memory,Daniel Kahneman
595448,24145,emma_bryce_how_do_the_lungs_work,How do the lungs work?,Emma Bryce
595448,63589,alex_gendler_how_do_ventilators_work,How do ventilators work?,Alex Gendler
595448,24274,katharina_ribbeck_how_mucus_keeps_us_healthy,How mucus keeps us healthy,Katharina Ribbeck
596934,153162,lenore_skenazy_why_you_should_spend_less_time_with_your_kids,Why you should spend less time with your kids,Lenore Skenazy
596934,137460,jonathan_haidt_are_smartphones_ruining_childhood,Are smartphones ruining childhood?,Jonathan Haidt
596934,77111,yuko_munakata_the_science_behind_how_parents_affect_child_development,The science behind how parents affect child development,Yuko Munakata
596934,1974,jennifer_senior_for_parents_happiness_is_a_very_high_bar,"For parents, happiness is a very high bar",Jennifer Senior
596934,1732,geoffrey_canada_our_failing_schools_enough_is_enough,Our failing schools. Enough is enough!,Geoffrey Canada
596934,1675,bruce_feiler_agile_programming_for_your_family,Agile programming -- for your family,Bruce Feiler
597320,129029,aziz_abu_sarah_and_maoz_inon_a_palestinian_and_an_israeli_face_to_face,"A Palestinian and an Israeli, face to face",Aziz Abu Sarah and Maoz Inon
597320,112608,ian_bremmer_the_next_global_superpower_isn_t_who_you_think,The next global superpower isn't who you think,Ian Bremmer
597320,148425,ian_bremmer_why_ukraine_s_drone_attack_on_russia_changes_war_forever,Why Ukraine's drone attack on Russia changes war forever,Ian Bremmer
597320,1214,julia_bacha_pay_attention_to_nonviolence,Pay attention to nonviolence,Julia Bacha
597320,1003,stefan_wolff_the_path_to_ending_ethnic_conflicts,The path to ending ethnic conflicts,Stefan Wolff
597320,1839,trita_parsi_iran_and_israel_peace_is_possible,Iran and Israel: Peace is possible,Trita Parsi
596936,160683,deja_foxx_going_viral_taught_me_the_internet_is_broken_but_fixable,Going viral taught me the internet is broken — but fixable,Deja Foxx
596936,122557,sofia_ongele_your_creative_superpowers_can_help_protect_democracy,Your creative superpowers can help protect democracy,Sofia Ongele
596936,148344,adam_aleksic_are_we_cooked_how_social_media_shapes_your_language,Are we cooked? How social media shapes your language,Adam Aleksic
596936,1066,johanna_blakley_social_media_and_the_end_of_gender,Social media and the end of gender,Johanna Blakley
596936,641,evgeny_morozov_how_the_net_aids_dictatorships,How the Net aids dictatorships,Evgeny Morozov
596936,575,clay_shirky_how_social_media_can_make_history,How social media can make history,Clay Shirky
594328,158865,anshul_tewari_want_to_make_change_let_young_people_tell_their_stories,Want to make change? Let young people tell their stories,Anshul Tewari
594328,142043,elise_hu_how_digital_culture_is_reshaping_our_faces_and_bodies,How digital culture is reshaping our faces and bodies,Elise Hu
594328,148344,adam_aleksic_are_we_cooked_how_social_media_shapes_your_language,Are we cooked? How social media shapes your language,Adam Aleksic
594328,1066,johanna_blakley_social_media_and_the_end_of_gender,Social media and the end of gender,Johanna Blakley
594328,575,clay_shirky_how_social_media_can_make_history,How social media can make history,Clay Shirky
594328,1436,gary_kovacs_tracking_our_online_trackers,Tracking our online trackers,Gary Kovacs
595676,44339,heidi_grant_how_to_ask_for_help_and_get_a_yes,"How to ask for help -- and get a ""yes""",Heidi Grant
595676,160681,bradley_tusk_and_ali_kashani_how_will_new_tech_shape_your_life_a_roboticist_and_a_political_strategist_answer,How will new tech shape your life? A roboticist and a political strategist answer,Bradley Tusk and Ali Kashani
595676,160811,yancey_strickler_and_jenny_du_how_do_you_rethink_how_the_world_works_an_entrepreneur_and_an_engineer_answer,How do you rethink how the world works? An entrepreneur and an engineer answer,Yancey Strickler and Jenny Du
595676,2841,tom_gruber_how_ai_can_enhance_our_memory_work_and_social_lives,"How AI can enhance our memory, work and social lives",Tom Gruber
595676,17851,max_tegmark_how_to_get_empowered_not_overpowered_by_ai,"How to get empowered, not overpowered, by AI",Max Tegmark
595676,20368,kai_fu_lee_how_ai_can_save_our_humanity,How AI can save our humanity,Kai-Fu Lee
587540,24724,kim_preshoff_what_s_a_smartphone_made_of,What's a smartphone made of?,Kim Preshoff
587540,138317,aaron_perzanowski_why_don_t_companies_want_you_to_repair_your_stuff,Why don’t companies want you to repair your stuff?,Aaron Perzanowski
587540,96034,charles_wallace_and_sajan_saini_why_a_sausage_can_do_what_your_gloves_cannot,Why a sausage can do what your gloves cannot,Charles Wallace and Sajan Saini
595674,159831,melinda_janki_how_we_took_on_an_oil_giant_and_won,How we took on an oil giant — and won,Melinda Janki
595674,155791,al_gore_why_climate_action_is_unstoppable_and_climate_realism_is_a_myth,"Why climate action is unstoppable — and ""climate realism"" is a myth",Al Gore
595674,73953,ted_ed_how_much_electricity_does_it_take_to_power_the_world,How much electricity does it take to power the world?, TED-Ed
595674,1754,alex_laskey_how_behavioral_science_can_lower_your_energy_bill,How behavioral science can lower your energy bill,Alex Laskey
595674,1434,amory_lovins_a_40_year_plan_for_energy,A 40-year plan for energy,Amory Lovins
595674,828,catherine_mohr_the_tradeoffs_of_building_green,The tradeoffs of building green,Catherine Mohr
594333,159974,rob_bredow_and_nora_atkinson_what_will_the_future_of_art_look_like_a_visual_effects_artist_and_a_curator_answer,What will the future of art look like? A visual effects artist and a curator answer,Rob Bredow and Nora Atkinson
594333,156781,kiran_bhat_how_to_build_the_3d_world_of_your_dreams_with_just_a_text_prompt,How to build the 3D world of your dreams with just a text prompt,Kiran Bhat
594333,157642,jason_zada_how_to_turn_ai_prompts_into_movie_magic,How to turn AI prompts into movie magic,Jason Zada
594333,2841,tom_gruber_how_ai_can_enhance_our_memory_work_and_social_lives,"How AI can enhance our memory, work and social lives",Tom Gruber
594333,20368,kai_fu_lee_how_ai_can_save_our_humanity,How AI can save our humanity,Kai-Fu Lee
594333,17851,max_tegmark_how_to_get_empowered_not_overpowered_by_ai,"How to get empowered, not overpowered, by AI",Max Tegmark
595446,132554,stephen_esposito_what_really_happened_to_oedipus,What really happened to Oedipus?,Stephen Esposito
595446,71212,iseult_gillespie_savitri_and_satyavan_the_legend_of_the_princess_who_outwitted_death,Savitri and Satyavan: The legend of the princess who outwitted Death,Iseult Gillespie
595446,27674,alex_gendler_the_myth_of_sisyphus,The myth of Sisyphus,Alex Gendler
590428,148434,dustin_ballard_is_ai_ruining_music,Is AI ruining music?,Dustin Ballard
590428,152993,amie_mcnee_the_case_for_making_art_when_the_world_is_on_fire,The case for making art when the world is on fire,Amie McNee
590428,148236,navied_mahdavian_how_art_helped_me_grapple_with_grief,How art helped me grapple with grief,Navied Mahdavian
590428,1169,shea_hembrey_how_i_became_100_artists,How I became 100 artists,Shea Hembrey
590428,831,thelma_golden_how_art_gives_shape_to_cultural_change,How art gives shape to cultural change,Thelma Golden
590428,3618,hadi_eldebek_why_must_artists_be_poor,Why must artists be poor?,Hadi Eldebek
595670,157718,david_fajgenbaum_how_nearly_dying_helped_me_discover_my_own_cure_and_many_more,How nearly dying helped me discover my own cure (and many more),David Fajgenbaum
595670,91521,celina_de_sola_mental_health_care_that_disrupts_cycles_of_violence,Mental health care that disrupts cycles of violence,Celina de Sola
595670,159974,rob_bredow_and_nora_atkinson_what_will_the_future_of_art_look_like_a_visual_effects_artist_and_a_curator_answer,What will the future of art look like? A visual effects artist and a curator answer,Rob Bredow and Nora Atkinson
595670,2076,rishi_manchanda_what_makes_us_get_sick_look_upstream,What makes us get sick? Look upstream,Rishi Manchanda
595670,2098,gail_reed_where_to_train_the_world_s_doctors_cuba,Where to train the world's doctors? Cuba.,Gail Reed
595670,1557,vikram_patel_mental_health_for_all_by_involving_all,Mental health for all by involving all,Vikram Patel
594092,135146,louise_thwaites_why_is_it_so_dangerous_to_step_on_a_rusty_nail,Why is it so dangerous to step on a rusty nail?,Louise Thwaites
594092,46518,ben_longdon_how_do_viruses_jump_from_animals_to_humans,How do viruses jump from animals to humans?,Ben Longdon
594092,142579,hei_man_chan_what_actually_causes_high_cholesterol,What actually causes high cholesterol?,Hei Man Chan
594325,82300,dan_kwartler_why_don_t_we_cover_the_desert_with_solar_panels,Why don't we cover the desert with solar panels?,Dan Kwartler
594325,159494,mfikeyi_makayi_the_emerging_science_of_finding_critical_metals,The emerging science of finding critical metals ,Mfikeyi Makayi
594325,160076,amy_barnes_will_climate_change_make_your_home_uninsurable,Will climate change make your home uninsurable?,Amy Barnes
594325,37346,marjan_van_aubel_the_beautiful_future_of_solar_power,The beautiful future of solar power,Marjan van Aubel
594325,1248,bunker_roy_learning_from_a_barefoot_movement,Learning from a barefoot movement,Bunker Roy
594325,9983,hannah_burckstummer_a_printable_flexible_organic_solar_cell,"A printable, flexible, organic solar cell",Hannah Bürckstümmer
591849,94633,olivia_lazard_the_blind_spots_of_the_green_energy_transition,The blind spots of the green energy transition,Olivia Lazard
591849,155791,al_gore_why_climate_action_is_unstoppable_and_climate_realism_is_a_myth,"Why climate action is unstoppable — and ""climate realism"" is a myth",Al Gore
591849,133752,saleem_ali_the_fight_over_minerals_for_green_energy_and_a_better_way_forward,The fight over minerals for green energy — and a better way forward,Saleem Ali
591849,2841,tom_gruber_how_ai_can_enhance_our_memory_work_and_social_lives,"How AI can enhance our memory, work and social lives",Tom Gruber
591849,17851,max_tegmark_how_to_get_empowered_not_overpowered_by_ai,"How to get empowered, not overpowered, by AI",Max Tegmark
591849,2645,kevin_kelly_how_ai_can_bring_on_a_second_industrial_revolution,How AI can bring on a second Industrial Revolution,Kevin Kelly
595444,87464,emily_zobel_marshall_the_myth_of_anansi_the_trickster_spider,"The myth of Anansi, the trickster spider",Emily Zobel Marshall
595444,52402,alex_gendler_the_myth_of_loki_and_the_master_builder,The myth of Loki and the master builder,Alex Gendler
595444,97364,iseult_gillespie_the_myth_of_zeus_test,The myth of Zeus' test,Iseult Gillespie
595373,97793,gloria_chan_packer_work_is_not_your_family_sep_2022,Work is not your family,Gloria Chan Packer
595373,111970,anne_morriss_5_steps_to_fix_any_problem_at_work,5 steps to fix any problem at work,Anne Morriss
595373,156619,rafael_chiuzi_the_most_powerful_predictor_of_team_success,The most powerful predictor of team success,Rafael Chiuzi
595373,9463,susan_david_the_gift_and_power_of_emotional_courage,The gift and power of emotional courage,Susan David
595373,7592,tiffany_watt_smith_the_history_of_human_emotions,The history of human emotions,Tiffany Watt Smith
595373,2279,rana_el_kaliouby_this_app_knows_how_you_feel_from_the_look_on_your_face,This app knows how you feel -- from the look on your face,Rana el Kaliouby
592537,160608,harjeet_singh_floating_farms_sponge_cities_and_the_climate_solutions_already_working,"Floating farms, sponge cities and the climate solutions already working",Harjeet Singh
592537,155791,al_gore_why_climate_action_is_unstoppable_and_climate_realism_is_a_myth,"Why climate action is unstoppable — and ""climate realism"" is a myth",Al Gore
592537,158932,ilona_szabo_de_carvalho_the_world_s_first_nature_superpower,"The world's first ""nature superpower""",Ilona Szabó de Carvalho
592537,940,lisa_margonelli_the_political_chemistry_of_oil,The political chemistry of oil,Lisa Margonelli
592537,1394,t_boone_pickens_let_s_transform_energy_with_natural_gas,Let's transform energy -- with natural gas,T. Boone Pickens
592537,862,richard_sears_planning_for_the_end_of_oil,Planning for the end of oil,Richard Sears
594533,148431,yancey_strickler_forget_hustle_culture_behold_the_artist_corporation,Forget hustle culture. Behold the Artist Corporation,Yancey Strickler
594533,158573,jenny_du_the_science_of_making_fruits_and_veggies_last_longer,The science of making fruits and veggies last longer,Jenny Du
594533,136281,yara_shahidi_and_anil_seth_what_makes_you_you_an_actor_and_a_neuroscientist_answer,What makes you “you”? An actor and a neuroscientist answer,Yara Shahidi and Anil Seth
594533,21307,leticia_gasca_don_t_fail_fast_fail_mindfully,Don't fail fast -- fail mindfully,Leticia Gasca
594533,1592,melissa_marshall_talk_nerdy_to_me,Talk nerdy to me,Melissa Marshall
594533,572,richard_st_john_success_is_a_continuous_journey,Success is a continuous journey,Richard St. John
595205,147981,taylor_lynn_carpenter_parkour_how_the_sport_keeps_your_body_and_mind_fit,Parkour! How the sport keeps your body and mind fit,Taylor Lynn Carpenter
595205,147778,shane_battier_an_nba_champion_s_advice_on_being_a_top_teammate,An NBA champion's advice on being a top teammate,Shane Battier
595205,117221,emmanuel_acho_why_you_should_stop_setting_goals_yes_really,"Why you should stop setting goals (yes, really)",Emmanuel Acho
595205,1841,andrew_fitzgerald_adventures_in_twitter_fiction,Adventures in Twitter fiction,Andrew Fitzgerald
595205,1379,andrew_stanton_the_clues_to_a_great_story,The clues to a great story,Andrew Stanton
595205,1282,joe_sabia_the_technology_of_storytelling,The technology of storytelling,Joe Sabia
592539,111819,david_m_howard_can_we_recreate_the_voice_of_a_3_000_year_old_mummy,"Can we recreate the voice of a 3,000-year-old mummy?",David M. Howard
592539,65437,michael_corballis_evolution_s_great_mystery_language,Evolution's great mystery: Language,Michael Corballis
592539,137891,nicky_trevorrow_how_to_make_your_cat_happier_in_3_minutes,How to make your cat happier — in 3 minutes,Nicky Trevorrow
592539,1203,mark_pagel_how_language_transformed_humanity,How language transformed humanity,Mark Pagel
592539,164,steven_pinker_what_our_language_habits_reveal,What our language habits reveal,Steven Pinker
592539,24232,claire_bowern_where_did_english_come_from,Where did English come from?,Claire Bowern
593674,147329,laura_miele_the_power_of_gaming_together_in_a_lonely_world,The power of gaming together in a lonely world,Laura Miele
593674,107970,kris_alexander_how_video_games_can_level_up_the_way_you_learn,How video games can level up the way you learn,Kris Alexander
593674,156781,kiran_bhat_how_to_build_the_3d_world_of_your_dreams_with_just_a_text_prompt,How to build the 3D world of your dreams with just a text prompt,Kiran Bhat
593674,2894,sara_dewitt_3_fears_about_screen_time_for_kids_and_why_they_re_not_true,3 fears about screen time for kids -- and why they're not true,Sara DeWitt
593674,361,david_perry_are_games_better_than_life,Are games better than life?,David Perry
593674,1618,daphne_bavelier_your_brain_on_video_games,Your brain on video games,Daphne Bavelier
591506,156845,julienne_oyler_how_displaced_people_are_driving_local_economies,How displaced people are driving local economies,Julienne Oyler
591506,91521,celina_de_sola_mental_health_care_that_disrupts_cycles_of_violence,Mental health care that disrupts cycles of violence,Celina de Sola
591506,115255,anika_goss_detroit_s_climate_crisis_and_how_to_build_a_resilient_future_everywhere,Detroit's climate crisis — and how to build a resilient future everywhere,Anika Goss
591506,1864,mohamed_ali_the_link_between_unemployment_and_terrorism,The link between unemployment and terrorism,Mohamed Ali
591506,2139,robert_muggah_how_to_protect_fast_growing_cities_from_failing,How to protect fast-growing cities from failing,Robert Muggah
591506,2107,alessandra_orofino_it_s_our_city_let_s_fix_it,It’s our city. Let’s fix it,Alessandra Orofino
593185,160608,harjeet_singh_floating_farms_sponge_cities_and_the_climate_solutions_already_working,"Floating farms, sponge cities and the climate solutions already working",Harjeet Singh
593185,88842,orit_tykocinski_the_counterintuitive_psychology_of_insurance,The counterintuitive psychology of insurance,Orit Tykocinski
593185,157985,lei_zhang_the_powerful_promise_of_earth_s_harshest_places,The powerful promise of Earth’s harshest places,Lei Zhang
593185,192,david_keith_a_critical_look_at_geoengineering_against_climate_change,A critical look at geoengineering against climate change,David Keith
593185,2784,ted_halstead_a_climate_solution_where_all_sides_can_win,A climate solution where all sides can win,Ted Halstead
593185,243,al_gore_new_thinking_on_the_climate_crisis,New thinking on the climate crisis,Al Gore
581928,130568,sonia_vallabh_my_quest_to_cure_prion_disease_before_it_s_too_late,My quest to cure prion disease — before it's too late,Sonia Vallabh
581928,157718,david_fajgenbaum_how_nearly_dying_helped_me_discover_my_own_cure_and_many_more,How nearly dying helped me discover my own cure (and many more),David Fajgenbaum
581928,138369,katsuhiko_hayashi_a_mouse_with_two_dads_and_a_new_frontier_for_biology,A mouse with two dads — and a new frontier for biology,Katsuhiko Hayashi
581928,9982,matthias_mullenbeck_what_if_we_paid_doctors_to_keep_people_healthy,What if we paid doctors to keep people healthy?,Matthias Müllenbeck
581928,2076,rishi_manchanda_what_makes_us_get_sick_look_upstream,What makes us get sick? Look upstream,Rishi Manchanda
581928,2570,sebastian_kraves_the_era_of_personal_dna_testing_is_here,The era of personal DNA testing is here,Sebastian Kraves
594323,64912,ali_kashani_a_friendly_autonomous_robot_that_delivers_your_food,"A friendly, autonomous robot that delivers your food",Ali Kashani
594323,155248,bradley_tusk_why_you_should_be_able_to_vote_on_your_phone,Why you should be able to vote on your phone ,Bradley Tusk
594323,159974,rob_bredow_and_nora_atkinson_what_will_the_future_of_art_look_like_a_visual_effects_artist_and_a_curator_answer,What will the future of art look like? A visual effects artist and a curator answer,Rob Bredow and Nora Atkinson
594323,1709,keller_rinaudo_cliffton_a_mini_robot_powered_by_your_phone,A mini robot -- powered by your phone,Keller Rinaudo Cliffton
594323,1070,cynthia_breazeal_the_rise_of_personal_robots,The rise of personal robots,Cynthia Breazeal
594323,355,rodney_brooks_robots_will_invade_our_lives,Robots will invade our lives,Rodney Brooks
593340,148363,michael_vazquez_and_sarah_stroud_when_should_you_break_a_promise,When should you break a promise?,Michael Vazquez and Sarah Stroud
593340,158457,michael_vazquez_and_raye_ploeger_can_humans_be_trusted_with_control_over_genetics,Can humans be trusted with control over genetics?,Michael Vazquez and Raye Ploeger
593340,23919,joy_lin_if_superpowers_were_real_immortality,If superpowers were real: Immortality,Joy Lin
594074,156061,josephine_waweru_the_miraculous_device_that_saved_my_farm_and_changed_my_life,The miraculous device that saved my farm — and changed my life,Josephine Waweru
594074,137526,gabe_brown_how_regenerative_agriculture_brings_life_back_to_the_land,How regenerative agriculture brings life back to the land,Gabe Brown
594074,148237,ted_ed_this_is_how_nomadic_farmers_live,This is how nomadic farmers live,TED-Ed
594074,192,david_keith_a_critical_look_at_geoengineering_against_climate_change,A critical look at geoengineering against climate change,David Keith
594074,2093,lord_nicholas_stern_the_state_of_the_climate_and_what_we_might_do_about_it,The state of the climate — and what we might do about it,Lord Nicholas Stern
594074,1207,alex_steffen_the_shareable_future_of_cities,The shareable future of cities,Alex Steffen
574655,136666,brian_s_lowery_how_to_live_a_meaningful_life,How to live a meaningful life,Brian S. Lowery
574655,81396,olivia_affuso_3_ways_community_creates_a_healthy_life,3 ways community creates a healthy life,Olivia Affuso
574655,140318,rhaina_cohen_why_friendship_can_be_just_as_meaningful_as_romantic_love,Why friendship can be just as meaningful as romantic love,Rhaina Cohen
574655,9463,susan_david_the_gift_and_power_of_emotional_courage,The gift and power of emotional courage,Susan David
574655,2279,rana_el_kaliouby_this_app_knows_how_you_feel_from_the_look_on_your_face,This app knows how you feel -- from the look on your face,Rana el Kaliouby
574655,7592,tiffany_watt_smith_the_history_of_human_emotions,The history of human emotions,Tiffany Watt Smith
