id,slug,speakers,title,url
532021,hyunsoo_joshua_no_and_trudy_wu_how_do_doctors_determine_what_stage_of_cancer_you_have,Hyunsoo Joshua No and Trudy Wu,How do doctors determine what stage of cancer you have?,https://www.ted.com/talks/hyunsoo_joshua_no_and_trudy_wu_how_do_doctors_determine_what_stage_of_cancer_you_have
534082,alex_luebke_vivek_kumbhari_how_you_could_see_inside_your_body_with_a_micro_robot,"Alex Luebke, Vivek Kumbhari",How you could see inside your body — with a micro-robot,https://www.ted.com/talks/alex_luebke_vivek_kumbhari_how_you_could_see_inside_your_body_with_a_micro_robot
530824,storybook_maze_a_street_librarian_s_quest_to_bring_books_to_everyone,Storybook Maze,A street librarian's quest to bring books to everyone,https://www.ted.com/talks/storybook_maze_a_street_librarian_s_quest_to_bring_books_to_everyone
534911,david_friedberg_a_scientific_breakthrough_that_could_transform_how_we_produce_food,David Friedberg,A scientific breakthrough that could transform how we produce food,https://www.ted.com/talks/david_friedberg_a_scientific_breakthrough_that_could_transform_how_we_produce_food
533754,gina_marie_elia_the_secret_behind_how_chinese_characters_work,Gina Marie Elia,The secret behind how Chinese characters work,https://www.ted.com/talks/gina_marie_elia_the_secret_behind_how_chinese_characters_work
534120,uma_valeti_is_cultivated_meat_the_future_of_food,Uma Valeti,Is cultivated meat the future of food?,https://www.ted.com/talks/uma_valeti_is_cultivated_meat_the_future_of_food
532915,kelly_corrigan_to_love_is_to_be_brave,Kelly Corrigan,To love is to be brave,https://www.ted.com/talks/kelly_corrigan_to_love_is_to_be_brave
533750,stephen_esposito_what_really_happened_to_oedipus,Stephen Esposito,What really happened to Oedipus?,https://www.ted.com/talks/stephen_esposito_what_really_happened_to_oedipus
533961,justin_trudeau_leadership_lessons_from_the_prime_minister_of_canada,Justin Trudeau,Leadership lessons from the prime minister of Canada,https://www.ted.com/talks/justin_trudeau_leadership_lessons_from_the_prime_minister_of_canada
522396,ian_bassin_how_to_spot_authoritarianism_and_choose_democracy,Ian Bassin,How to spot authoritarianism — and choose democracy,https://www.ted.com/talks/ian_bassin_how_to_spot_authoritarianism_and_choose_democracy
533249,marcus_samuelsson_a_master_chef_s_take_on_food_culture_and_community,Marcus Samuelsson,"A master chef's take on food, culture and community",https://www.ted.com/talks/marcus_samuelsson_a_master_chef_s_take_on_food_culture_and_community
532483,fixable_fixable_live_a_conversation_with_scott_galloway,Fixable,Fixable Live - A conversation with Scott Galloway,https://www.ted.com/talks/fixable_fixable_live_a_conversation_with_scott_galloway
533959,niaz_nawab_ye_pariye_naz_simorgh_darya,Niaz Nawab,"""Ye Pariye Naz"" / ""Simorgh"" / ""Darya""",https://www.ted.com/talks/niaz_nawab_ye_pariye_naz_simorgh_darya
532957,adam_whybrew_why_you_should_talk_about_your_anxiety_at_work,Adam Whybrew,Why you should talk about your anxiety at work,https://www.ted.com/talks/adam_whybrew_why_you_should_talk_about_your_anxiety_at_work
526166,stephanie_pacheco_where_you_from_an_ode_to_the_bronx,Stephanie Pacheco,“where you from?” An ode to the Bronx,https://www.ted.com/talks/stephanie_pacheco_where_you_from_an_ode_to_the_bronx
528476,dan_katz_can_you_solve_the_basketball_riddle,Dan Katz,Can you solve the basketball riddle?,https://www.ted.com/talks/dan_katz_can_you_solve_the_basketball_riddle
533387,kasia_chmielinski_why_ai_needs_a_nutrition_label,Kasia Chmielinski,"Why AI needs a ""nutrition label""",https://www.ted.com/talks/kasia_chmielinski_why_ai_needs_a_nutrition_label
531432,jakob_christensen_dalsgaard_these_animals_can_hear_everything,Jakob Christensen-Dalsgaard,These animals can hear everything,https://www.ted.com/talks/jakob_christensen_dalsgaard_these_animals_can_hear_everything
532157,julie_and_john_gottman_even_healthy_couples_fight_the_difference_is_how,Julie and John Gottman,Even healthy couples fight — the difference is how,https://www.ted.com/talks/julie_and_john_gottman_even_healthy_couples_fight_the_difference_is_how
532913,paolo_gaudiano_what_dei_gets_wrong_and_how_to_do_it_right,Paolo Gaudiano,What DEI gets wrong — and how to do it right,https://www.ted.com/talks/paolo_gaudiano_what_dei_gets_wrong_and_how_to_do_it_right
532917,yoram_yovell_why_broken_hearts_hurt_and_what_heals_them,Yoram Yovell,Why broken hearts hurt — and what heals them,https://www.ted.com/talks/yoram_yovell_why_broken_hearts_hurt_and_what_heals_them
532481,design_matters_with_debbie_millman_carrie_brownstein,Design Matters with Debbie Millman,Carrie Brownstein,https://www.ted.com/talks/design_matters_with_debbie_millman_carrie_brownstein
532326,stephanie_honchell_smith_how_to_love_according_to_rumi,Stephanie Honchell Smith,"How to love, according to Rumi",https://www.ted.com/talks/stephanie_honchell_smith_how_to_love_according_to_rumi
532070,freada_kapor_klein_how_to_use_venture_capital_for_good,Freada Kapor Klein,How to use venture capital for good,https://www.ted.com/talks/freada_kapor_klein_how_to_use_venture_capital_for_good
530954,aruna_rangachar_pohl_a_snack_s_journey_from_the_farm_to_your_mouth,Aruna Rangachar Pohl,A snack's journey from the farm to your mouth,https://www.ted.com/talks/aruna_rangachar_pohl_a_snack_s_journey_from_the_farm_to_your_mouth
533087,bryan_william_jones_how_your_vision_determines_your_reality,Bryan William Jones,How your vision determines your reality,https://www.ted.com/talks/bryan_william_jones_how_your_vision_determines_your_reality
532005,max_g_levy_one_surgeon_s_obsession_with_head_transplants,Max G. Levy,One surgeon's obsession with head transplants,https://www.ted.com/talks/max_g_levy_one_surgeon_s_obsession_with_head_transplants
532068,rumman_chowdhury_your_right_to_repair_ai_systems,Rumman Chowdhury,Your right to repair AI systems,https://www.ted.com/talks/rumman_chowdhury_your_right_to_repair_ai_systems
526612,chezare_a_warren_the_difference_between_false_empathy_and_true_support,Chezare A. Warren,The difference between false empathy and true support,https://www.ted.com/talks/chezare_a_warren_the_difference_between_false_empathy_and_true_support
532063,vinod_khosla_12_predictions_for_the_future_of_technology,Vinod Khosla,12 predictions for the future of technology,https://www.ted.com/talks/vinod_khosla_12_predictions_for_the_future_of_technology
532061,adrienne_maree_brown_and_baratunde_thurston_how_to_imagine_a_better_future_for_democracy,adrienne maree brown and Baratunde Thurston,How to imagine a better future for democracy,https://www.ted.com/talks/adrienne_maree_brown_and_baratunde_thurston_how_to_imagine_a_better_future_for_democracy
532462,the_ted_ai_show_what_really_went_down_at_openai_and_the_future_of_regulation_w_helen_toner,The TED AI Show,What really went down at OpenAI and the future of regulation w/ Helen Toner,https://www.ted.com/talks/the_ted_ai_show_what_really_went_down_at_openai_and_the_future_of_regulation_w_helen_toner
531666,vivian_jiang_how_did_ancient_civilizations_make_ice_cream,Vivian Jiang,How did ancient civilizations make ice cream?,https://www.ted.com/talks/vivian_jiang_how_did_ancient_civilizations_make_ice_cream
530439,sonia_vallabh_my_quest_to_cure_prion_disease_before_it_s_too_late,Sonia Vallabh,My quest to cure prion disease — before it's too late,https://www.ted.com/talks/sonia_vallabh_my_quest_to_cure_prion_disease_before_it_s_too_late
531506,sagar_goel_an_optimist_s_take_on_reskilling_in_the_age_of_ai,Sagar Goel,An optimist's take on reskilling in the age of AI,https://www.ted.com/talks/sagar_goel_an_optimist_s_take_on_reskilling_in_the_age_of_ai
529957,bari_weiss_courage_the_most_important_virtue,Bari Weiss,"Courage, the most important virtue",https://www.ted.com/talks/bari_weiss_courage_the_most_important_virtue
529226,anna_rothschild_how_does_an_air_conditioner_actually_work,Anna Rothschild,How does an air conditioner actually work?,https://www.ted.com/talks/anna_rothschild_how_does_an_air_conditioner_actually_work
531747,tessa_west_the_problem_with_being_too_nice_at_work_sep_2024,Tessa West,"The problem with being ""too nice"" at work",https://www.ted.com/talks/tessa_west_the_problem_with_being_too_nice_at_work_sep_2024
530815,martin_gutmann_are_we_celebrating_the_wrong_leaders,Martin Gutmann,Are we celebrating the wrong leaders?,https://www.ted.com/talks/martin_gutmann_are_we_celebrating_the_wrong_leaders
529955,thomas_dohmke_with_ai_anyone_can_be_a_coder_now,Thomas Dohmke,"With AI, anyone can be a coder now",https://www.ted.com/talks/thomas_dohmke_with_ai_anyone_can_be_a_coder_now
528600,arika_okrent_why_is_english_so_confusing,Arika Okrent,Why is English so confusing?,https://www.ted.com/talks/arika_okrent_why_is_english_so_confusing
530635,angus_hervey_the_good_news_you_might_have_missed,Angus Hervey,The good news you might have missed,https://www.ted.com/talks/angus_hervey_the_good_news_you_might_have_missed
526918,thomas_hofweber_can_ai_predict_someone_s_breakup,Thomas Hofweber,Can AI predict someone's breakup?,https://www.ted.com/talks/thomas_hofweber_can_ai_predict_someone_s_breakup
522376,fatma_karume_how_to_fight_for_democracy_in_the_shadow_of_autocracy,Fatma Karume,How to fight for democracy in the shadow of autocracy,https://www.ted.com/talks/fatma_karume_how_to_fight_for_democracy_in_the_shadow_of_autocracy
526280,wan_faridah_akmal_jusoh_the_luminous_mystery_of_fireflies,Wan Faridah Akmal Jusoh,The luminous mystery of fireflies,https://www.ted.com/talks/wan_faridah_akmal_jusoh_the_luminous_mystery_of_fireflies
528337,christi_gendron_the_science_of_lifespan_and_the_impact_of_your_five_senses,Christi Gendron,The science of lifespan — and the impact of your five senses,https://www.ted.com/talks/christi_gendron_the_science_of_lifespan_and_the_impact_of_your_five_senses
526162,bea_rodriguez_fransen_unlocking_indigenous_knowledge_a_new_path_for_education,Bea Rodriguez-Fransen,Unlocking Indigenous knowledge: A new path for education,https://www.ted.com/talks/bea_rodriguez_fransen_unlocking_indigenous_knowledge_a_new_path_for_education
529938,stephanie_honchell_smith_has_there_ever_been_a_good_dictator,Stephanie Honchell Smith,Has there ever been a good dictator?,https://www.ted.com/talks/stephanie_honchell_smith_has_there_ever_been_a_good_dictator
530302,fei_fei_li_with_spatial_intelligence_ai_will_understand_the_real_world,Fei-Fei Li,"With spatial intelligence, AI will understand the real world",https://www.ted.com/talks/fei_fei_li_with_spatial_intelligence_ai_will_understand_the_real_world
519638,annalee_newitz_how_fantasy_worlds_can_spark_real_change,Annalee Newitz,How fantasy worlds can spark real change,https://www.ted.com/talks/annalee_newitz_how_fantasy_worlds_can_spark_real_change
528474,nicola_storelli_and_daniele_zanzi_scientists_are_obsessed_with_this_lake,Nicola Storelli and Daniele Zanzi,Scientists are obsessed with this lake,https://www.ted.com/talks/nicola_storelli_and_daniele_zanzi_scientists_are_obsessed_with_this_lake
529953,daniel_lubetzky_why_the_world_needs_more_builders_and_less_us_vs_them,Daniel Lubetzky,"Why the world needs more builders — and less ""us vs. them""",https://www.ted.com/talks/daniel_lubetzky_why_the_world_needs_more_builders_and_less_us_vs_them
529820,bill_ackman_an_activist_investor_on_challenging_the_status_quo,Bill Ackman,An activist investor on challenging the status quo,https://www.ted.com/talks/bill_ackman_an_activist_investor_on_challenging_the_status_quo
528335,meryam_sugulle_1_simple_question_that_could_improve_women_s_health,Meryam Sugulle,1 simple question that could improve women's health,https://www.ted.com/talks/meryam_sugulle_1_simple_question_that_could_improve_women_s_health
529941,ian_bremmer_how_far_away_is_a_ceasefire_an_update_on_gaza_and_the_rafah_invasion,Ian Bremmer,How far away is a ceasefire? An update on Gaza and the Rafah invasion,https://www.ted.com/talks/ian_bremmer_how_far_away_is_a_ceasefire_an_update_on_gaza_and_the_rafah_invasion
529056,joseph_lacey_how_could_so_many_people_support_hitler,Joseph Lacey,How could so many people support Hitler?,https://www.ted.com/talks/joseph_lacey_how_could_so_many_people_support_hitler
529322,sarah_j_doherty_how_aerosols_brighten_clouds_and_cool_the_planet,Sarah J. Doherty,How aerosols brighten clouds — and cool the planet,https://www.ted.com/talks/sarah_j_doherty_how_aerosols_brighten_clouds_and_cool_the_planet
529429,jason_rugolo_welcome_to_the_world_of_audio_computers,Jason Rugolo,Welcome to the world of audio computers,https://www.ted.com/talks/jason_rugolo_welcome_to_the_world_of_audio_computers
527910,luke_m_jacobus_why_do_bugs_swarm_over_water,Luke M. Jacobus,Why do bugs swarm over water?,https://www.ted.com/talks/luke_m_jacobus_why_do_bugs_swarm_over_water
528908,andrew_yang_why_us_politics_is_broken_and_how_to_fix_it,Andrew Yang,Why US politics is broken — and how to fix it,https://www.ted.com/talks/andrew_yang_why_us_politics_is_broken_and_how_to_fix_it
526278,randy_seriguchi_jr_the_us_has_a_teacher_shortage_here_s_how_to_fix_it,Randy Seriguchi Jr.,The US has a teacher shortage — here's how to fix it,https://www.ted.com/talks/randy_seriguchi_jr_the_us_has_a_teacher_shortage_here_s_how_to_fix_it
528423,the_audacious_project_audacious_dreams_celebrating_the_first_class_of_audacious_projects,The Audacious Project,Audacious Dreams: Celebrating the first class of Audacious Projects,https://www.ted.com/talks/the_audacious_project_audacious_dreams_celebrating_the_first_class_of_audacious_projects
524836,george_blair_west_is_your_partner_the_one_wrong_question,George Blair-West,"Is your partner ""the one?"" Wrong question",https://www.ted.com/talks/george_blair_west_is_your_partner_the_one_wrong_question
527908,ted_ed_how_to_increase_your_happiness, TED-Ed,How to increase your happiness,https://www.ted.com/talks/ted_ed_how_to_increase_your_happiness
529046,scott_galloway_how_the_us_is_destroying_young_people_s_future,Scott Galloway,How the US is destroying young people's future,https://www.ted.com/talks/scott_galloway_how_the_us_is_destroying_young_people_s_future
528484,helen_toner_how_to_govern_ai_even_if_it_s_hard_to_predict,Helen Toner,How to govern AI — even if it's hard to predict,https://www.ted.com/talks/helen_toner_how_to_govern_ai_even_if_it_s_hard_to_predict
525800,saket_soni_the_workers_rebuilding_communities_after_natural_disasters,Saket Soni,The workers rebuilding communities after natural disasters,https://www.ted.com/talks/saket_soni_the_workers_rebuilding_communities_after_natural_disasters
526880,george_zaidan_how_do_gas_masks_actually_work,George Zaidan,How do gas masks actually work?,https://www.ted.com/talks/george_zaidan_how_do_gas_masks_actually_work
527254,bonnie_hancock_my_epic_journey_becoming_the_fastest_person_to_paddle_around_australia,Bonnie Hancock,My epic journey becoming the fastest person to paddle around Australia,https://www.ted.com/talks/bonnie_hancock_my_epic_journey_becoming_the_fastest_person_to_paddle_around_australia
527863,demis_hassabis_how_ai_is_unlocking_the_secrets_of_nature_and_the_universe,Demis Hassabis,How AI is unlocking the secrets of nature and the universe,https://www.ted.com/talks/demis_hassabis_how_ai_is_unlocking_the_secrets_of_nature_and_the_universe
528495,ryan_panchadsaram_anjali_grover_and_david_biello_an_updated_action_plan_for_solving_the_climate_crisis_and_a_look_at_progress_to_date,"Ryan Panchadsaram, Anjali Grover and David Biello",An updated action plan for solving the climate crisis — and a look at progress to date,https://www.ted.com/talks/ryan_panchadsaram_anjali_grover_and_david_biello_an_updated_action_plan_for_solving_the_climate_crisis_and_a_look_at_progress_to_date
528289,pete_stavros_the_secret_ingredient_of_business_success,Pete Stavros,The secret ingredient of business success,https://www.ted.com/talks/pete_stavros_the_secret_ingredient_of_business_success
528604,ted_openai_and_paul_trillo_what_ted_will_look_like_in_40_years_according_to_sora,"TED, OpenAI and Paul Trillo",What TED will look like in 40 years — according to Sora,https://www.ted.com/talks/ted_openai_and_paul_trillo_what_ted_will_look_like_in_40_years_according_to_sora
521815,geoffrey_e_braswell_the_rise_and_fall_of_the_maya_empire_s_most_powerful_city,Geoffrey E. Braswell,The rise and fall of the Maya Empire’s most powerful city,https://www.ted.com/talks/geoffrey_e_braswell_the_rise_and_fall_of_the_maya_empire_s_most_powerful_city
527006,oral_mcguire_how_to_live_with_fire,Oral McGuire,How to live with fire,https://www.ted.com/talks/oral_mcguire_how_to_live_with_fire
528005,niceaunties_the_weird_and_wonderful_art_of_niceaunties, Niceaunties,The weird and wonderful art of Niceaunties,https://www.ted.com/talks/niceaunties_the_weird_and_wonderful_art_of_niceaunties
526878,jacqueline_doan_and_alex_kazachek_does_math_have_a_major_flaw,Jacqueline Doan and Alex Kazachek,Does math have a major flaw?,https://www.ted.com/talks/jacqueline_doan_and_alex_kazachek_does_math_have_a_major_flaw
525798,kelly_d_parker_the_art_of_persuasive_storytelling,Kelly D. Parker,The art of persuasive storytelling,https://www.ted.com/talks/kelly_d_parker_the_art_of_persuasive_storytelling
525470,louise_mabulo_a_climate_solution_the_wisdom_passed_down_through_generations,Louise Mabulo,A climate solution? The wisdom passed down through generations,https://www.ted.com/talks/louise_mabulo_a_climate_solution_the_wisdom_passed_down_through_generations
528011,mustafa_suleyman_what_is_an_ai_anyway,Mustafa Suleyman,What is an AI anyway?,https://www.ted.com/talks/mustafa_suleyman_what_is_an_ai_anyway
527782,daniela_rus_how_ai_will_step_off_the_screen_and_into_the_real_world,Daniela Rus,How AI will step off the screen and into the real world,https://www.ted.com/talks/daniela_rus_how_ai_will_step_off_the_screen_and_into_the_real_world
527319,joseph_lacey_picture_a_perfect_society_what_does_it_look_like,Joseph Lacey,Picture a perfect society. What does it look like?,https://www.ted.com/talks/joseph_lacey_picture_a_perfect_society_what_does_it_look_like
522923,gabriel_marmentini_how_to_be_an_active_citizen_and_spark_change,Gabriel Marmentini,How to be an active citizen and spark change,https://www.ted.com/talks/gabriel_marmentini_how_to_be_an_active_citizen_and_spark_change
527649,aziz_abu_sarah_and_maoz_inon_a_palestinian_and_an_israeli_face_to_face,Aziz Abu Sarah and Maoz Inon,"A Palestinian and an Israeli, face to face",https://www.ted.com/talks/aziz_abu_sarah_and_maoz_inon_a_palestinian_and_an_israeli_face_to_face
526916,brian_crim_the_nazis_recruited_to_win_the_cold_war,Brian Crim,The Nazis recruited to win the Cold War,https://www.ted.com/talks/brian_crim_the_nazis_recruited_to_win_the_cold_war
525472,hanjo_seibert_what_you_can_do_to_stop_economic_crime,Hanjo Seibert,What you can do to stop economic crime,https://www.ted.com/talks/hanjo_seibert_what_you_can_do_to_stop_economic_crime
526994,fixable_unsolicited_advice_boeing_how_to_lead_in_a_crisis,Fixable,Unsolicited Advice: Boeing & how to lead in a crisis,https://www.ted.com/talks/fixable_unsolicited_advice_boeing_how_to_lead_in_a_crisis
526160,matthew_ebert_3_strategies_to_address_the_teacher_shortage_crisis,Matthew Ebert,3 strategies to address the teacher shortage crisis,https://www.ted.com/talks/matthew_ebert_3_strategies_to_address_the_teacher_shortage_crisis
526876,stephanie_honchell_smith_how_to_prevent_political_corruption,Stephanie Honchell Smith,How to prevent political corruption,https://www.ted.com/talks/stephanie_honchell_smith_how_to_prevent_political_corruption
525593,desiree_akhavan_why_you_should_disappoint_your_parents,Desiree Akhavan,Why you should disappoint your parents,https://www.ted.com/talks/desiree_akhavan_why_you_should_disappoint_your_parents
522492,ted_tech_why_people_and_ai_make_good_business_partners,TED Tech,Why people and AI make good business partners ,https://www.ted.com/talks/ted_tech_why_people_and_ai_make_good_business_partners
523970,jen_walsh_can_cannabis_help_you_sleep_here_s_the_science,Jen Walsh,Can cannabis help you sleep? Here's the science,https://www.ted.com/talks/jen_walsh_can_cannabis_help_you_sleep_here_s_the_science
524525,adam_clulow_the_true_story_behind_the_legend_of_the_47_ronin,Adam Clulow,The true story behind the legend of the 47 Rōnin,https://www.ted.com/talks/adam_clulow_the_true_story_behind_the_legend_of_the_47_ronin
509331,tracie_revis_a_new_national_park_to_reclaim_indigenous_land,Tracie Revis,A new national park to reclaim Indigenous land,https://www.ted.com/talks/tracie_revis_a_new_national_park_to_reclaim_indigenous_land
525599,chris_anderson_and_monique_ruff_bell_ideas_change_everything_and_what_s_next_for_ted,Chris Anderson and Monique Ruff-Bell,Ideas change everything — and what's next for TED,https://www.ted.com/talks/chris_anderson_and_monique_ruff_bell_ideas_change_everything_and_what_s_next_for_ted
524513,dyhia_belhabib_can_ai_catch_criminals_at_sea,Dyhia Belhabib,Can AI catch criminals at sea?,https://www.ted.com/talks/dyhia_belhabib_can_ai_catch_criminals_at_sea
524221,tunde_olaniran_music_movement_and_poetry,Tunde Olaniran,"Music, movement and poetry",https://www.ted.com/talks/tunde_olaniran_music_movement_and_poetry
524816,noah_charney_why_is_the_scream_screaming,Noah Charney,"Why is ""The Scream"" screaming?",https://www.ted.com/talks/noah_charney_why_is_the_scream_screaming
521884,catalina_lotero_a_futuristic_vision_for_latin_america_rooted_in_ancient_design,Catalina Lotero,"A futuristic vision for Latin America, rooted in ancient design",https://www.ted.com/talks/catalina_lotero_a_futuristic_vision_for_latin_america_rooted_in_ancient_design
520637,sarah_edmondson_how_to_spot_a_cult,Sarah Edmondson,How to spot a cult,https://www.ted.com/talks/sarah_edmondson_how_to_spot_a_cult
524527,henry_ou_what_is_earwax_and_should_you_get_rid_of_it,Henry Ou,What is earwax — and should you get rid of it?,https://www.ted.com/talks/henry_ou_what_is_earwax_and_should_you_get_rid_of_it
522495,anthony_tan_and_amane_dannouni_want_to_succeed_in_business_find_a_problem_to_solve,Anthony Tan and Amane Dannouni,Want to succeed in business? Find a problem to solve,https://www.ted.com/talks/anthony_tan_and_amane_dannouni_want_to_succeed_in_business_find_a_problem_to_solve
525168,maria_sophocles_what_happens_to_sex_in_midlife_a_look_at_the_bedroom_gap,Maria Sophocles,"What happens to sex in midlife? A look at the ""bedroom gap""",https://www.ted.com/talks/maria_sophocles_what_happens_to_sex_in_midlife_a_look_at_the_bedroom_gap
522925,jordan_klepper_a_comedian_s_take_on_how_to_save_democracy,Jordan Klepper,A comedian's take on how to save democracy,https://www.ted.com/talks/jordan_klepper_a_comedian_s_take_on_how_to_save_democracy
521226,how_to_be_a_better_human_alok_is_microdosing_creativity_and_rejecting_norms,How to Be a Better Human,ALOK is microdosing creativity and rejecting norms,https://www.ted.com/talks/how_to_be_a_better_human_alok_is_microdosing_creativity_and_rejecting_norms
523866,xiaojun_tom_wang_the_human_cost_of_coal_mining_in_china,"Xiaojun ""Tom"" Wang",The human cost of coal mining in China,https://www.ted.com/talks/xiaojun_tom_wang_the_human_cost_of_coal_mining_in_china
522399,ted_health_the_bias_behind_your_undiagnosed_chronic_pain,TED Health,The bias behind your undiagnosed chronic pain ,https://www.ted.com/talks/ted_health_the_bias_behind_your_undiagnosed_chronic_pain
521786,shannon_odell_what_earth_in_2050_could_look_like,Shannon Odell,What Earth in 2050 could look like,https://www.ted.com/talks/shannon_odell_what_earth_in_2050_could_look_like
524081,philipp_carlsson_szlezak_how_to_live_with_economic_doomsaying,Philipp Carlsson-Szlezak,How to live with economic doomsaying,https://www.ted.com/talks/philipp_carlsson_szlezak_how_to_live_with_economic_doomsaying
525467,the_ted_interview_how_bill_gates_spends_9_billion_a_year,The TED Interview,How Bill Gates spends $9 billion a year,https://www.ted.com/talks/the_ted_interview_how_bill_gates_spends_9_billion_a_year
522398,jim_snabe_your_invitation_to_help_build_a_sustainable_future,Jim Snabe,Your invitation to help build a sustainable future,https://www.ted.com/talks/jim_snabe_your_invitation_to_help_build_a_sustainable_future
524079,rebecca_mcmackin_let_your_garden_grow_wild,Rebecca McMackin,Let your garden grow wild,https://www.ted.com/talks/rebecca_mcmackin_let_your_garden_grow_wild
522433,iseult_gillespie_the_greek_myth_of_demeter_s_revenge,Iseult Gillespie,The Greek myth of Demeter's revenge,https://www.ted.com/talks/iseult_gillespie_the_greek_myth_of_demeter_s_revenge
523863,ken_goldberg_why_don_t_we_have_better_robots_yet,Ken Goldberg,Why don't we have better robots yet?,https://www.ted.com/talks/ken_goldberg_why_don_t_we_have_better_robots_yet
522927,amber_cabral_3_steps_to_better_connect_with_your_fellow_humans,Amber Cabral,3 steps to better connect with your fellow humans,https://www.ted.com/talks/amber_cabral_3_steps_to_better_connect_with_your_fellow_humans
521539,daniella_ballou_aares_how_business_leaders_can_renew_democracy,Daniella Ballou-Aares,How business leaders can renew democracy,https://www.ted.com/talks/daniella_ballou_aares_how_business_leaders_can_renew_democracy
523993,veronica_kalas_the_underground_cities_of_the_byzantine_empire,Veronica Kalas,The underground cities of the Byzantine Empire,https://www.ted.com/talks/veronica_kalas_the_underground_cities_of_the_byzantine_empire
521886,diarra_bousso_how_to_choose_clothes_for_longevity_not_the_landfill,Diarra Bousso,"How to choose clothes for longevity, not the landfill",https://www.ted.com/talks/diarra_bousso_how_to_choose_clothes_for_longevity_not_the_landfill
522612,madison_mohns_ai_and_the_paradox_of_self_replacing_workers,Madison Mohns,AI and the paradox of self-replacing workers,https://www.ted.com/talks/madison_mohns_ai_and_the_paradox_of_self_replacing_workers
