id,slug,speakers,title,url
498681,mar_hershenson_the_secret_to_successfully_pitching_an_idea,Mar Hershenson,The secret to successfully pitching an idea,https://www.ted.com/talks/mar_hershenson_the_secret_to_successfully_pitching_an_idea
502031,adrian_fisher_the_hidden_world_of_maze_design,Adrian Fisher,The hidden world of maze design,https://www.ted.com/talks/adrian_fisher_the_hidden_world_of_maze_design
498820,sims_witherspoon_can_ai_help_solve_the_climate_crisis,Sims Witherspoon,Can AI help solve the climate crisis?,https://www.ted.com/talks/sims_witherspoon_can_ai_help_solve_the_climate_crisis
501331,allison_leigh_why_is_this_painting_of_a_black_square_famous,Allison Leigh,Why is this painting of a black square famous?,https://www.ted.com/talks/allison_leigh_why_is_this_painting_of_a_black_square_famous
499631,rebecca_collyer_how_to_supercharge_renewables_and_energize_the_world,Rebecca Collyer,How to supercharge renewables and energize the world,https://www.ted.com/talks/rebecca_collyer_how_to_supercharge_renewables_and_energize_the_world
490116,kala_constantino_an_economy_powered_by_sun_and_wind_it_s_almost_here,Kala Constantino,An economy powered by sun and wind — it's almost here,https://www.ted.com/talks/kala_constantino_an_economy_powered_by_sun_and_wind_it_s_almost_here
500040,al_roker_an_extreme_weather_report_from_america_s_weatherman,Al Roker,An extreme weather report from America's weatherman,https://www.ted.com/talks/al_roker_an_extreme_weather_report_from_america_s_weatherman
501326,nanshu_lu_e_skins_and_e_tattoos_your_cybernetic_future,Nanshu Lu,E-skins and e-tattoos: Your cybernetic future,https://www.ted.com/talks/nanshu_lu_e_skins_and_e_tattoos_your_cybernetic_future
500931,antonio_machado_allison_what_happens_when_you_fall_into_piranha_infested_waters,Antonio Machado-Allison,What happens when you fall into piranha-infested waters? ,https://www.ted.com/talks/antonio_machado_allison_what_happens_when_you_fall_into_piranha_infested_waters
500483,natalie_cargill_how_to_solve_the_world_s_biggest_problems,Natalie Cargill,How to solve the world's biggest problems,https://www.ted.com/talks/natalie_cargill_how_to_solve_the_world_s_biggest_problems
495827,changhua_wu_can_the_us_and_china_take_on_climate_change_together,Changhua Wu,Can the US and China take on climate change together?,https://www.ted.com/talks/changhua_wu_can_the_us_and_china_take_on_climate_change_together
495602,becky_kennedy_the_single_most_important_parenting_strategy,Becky Kennedy,The single most important parenting strategy,https://www.ted.com/talks/becky_kennedy_the_single_most_important_parenting_strategy
499623,peter_mcindoe_birds_aren_t_real_how_a_conspiracy_takes_flight,Peter McIndoe,Birds aren't real? How a conspiracy takes flight,https://www.ted.com/talks/peter_mcindoe_birds_aren_t_real_how_a_conspiracy_takes_flight
500520,ted_ed_can_you_change_your_sleep_schedule,TED-Ed,Can you change your sleep schedule?,https://www.ted.com/talks/ted_ed_can_you_change_your_sleep_schedule
498670,gorick_ng_how_to_succeed_in_your_new_job,Gorick Ng,How to succeed in your new job,https://www.ted.com/talks/gorick_ng_how_to_succeed_in_your_new_job
499458,sarah_aviram_does_more_freedom_at_work_mean_more_fulfillment_sep_2023,Sarah Aviram,Does more freedom at work mean more fulfillment?,https://www.ted.com/talks/sarah_aviram_does_more_freedom_at_work_mean_more_fulfillment_sep_2023
490776,k_allado_mcdowell_our_creative_relationship_with_ai_is_just_beginning,K Allado-McDowell,Our creative relationship with AI is just beginning,https://www.ted.com/talks/k_allado_mcdowell_our_creative_relationship_with_ai_is_just_beginning
483765,dan_finkel_can_you_solve_the_cursed_dice_riddle,Dan Finkel,Can you solve the cursed dice riddle?,https://www.ted.com/talks/dan_finkel_can_you_solve_the_cursed_dice_riddle
496959,bob_wiltfong_how_to_take_the_bs_out_of_business_speak_sep_2023,Bob Wiltfong,How to take the BS out of business speak,https://www.ted.com/talks/bob_wiltfong_how_to_take_the_bs_out_of_business_speak_sep_2023
498691,emmanuel_acho_why_you_should_stop_setting_goals_yes_really,Emmanuel Acho,"Why you should stop setting goals (yes, really)",https://www.ted.com/talks/emmanuel_acho_why_you_should_stop_setting_goals_yes_really
499996,hilde_stenuit_how_new_drugs_could_come_from_space,Hilde Stenuit, How new drugs could come from space,https://www.ted.com/talks/hilde_stenuit_how_new_drugs_could_come_from_space
497385,shannon_odell_this_is_what_happens_when_you_hit_the_gas,Shannon Odell,This is what happens when you hit the gas,https://www.ted.com/talks/shannon_odell_this_is_what_happens_when_you_hit_the_gas
496030,amy_baxter_how_to_hack_your_brain_when_you_re_in_pain,Amy Baxter,How to hack your brain when you're in pain,https://www.ted.com/talks/amy_baxter_how_to_hack_your_brain_when_you_re_in_pain
499820,kristin_barry_new_discoveries_on_the_quest_to_cure_tinnitus,Kristin Barry,New discoveries on the quest to cure tinnitus,https://www.ted.com/talks/kristin_barry_new_discoveries_on_the_quest_to_cure_tinnitus
495849,karen_willcox_how_digital_twins_could_help_us_predict_the_future,Karen Willcox,"How ""digital twins"" could help us predict the future",https://www.ted.com/talks/karen_willcox_how_digital_twins_could_help_us_predict_the_future
498072,ted_ed_why_is_it_so_hard_to_break_a_bad_habit,TED-Ed,Why is it so hard to break a bad habit?,https://www.ted.com/talks/ted_ed_why_is_it_so_hard_to_break_a_bad_habit
495845,bilawal_sidhu_the_ai_powered_tools_supercharging_your_imagination,Bilawal Sidhu,The AI-powered tools supercharging your imagination,https://www.ted.com/talks/bilawal_sidhu_the_ai_powered_tools_supercharging_your_imagination
498596,mariela_pajuelo_and_javier_antonio_quinones_the_one_thing_stopping_jellyfish_from_taking_over,Mariela Pajuelo and Javier Antonio Quinones,The one thing stopping jellyfish from taking over,https://www.ted.com/talks/mariela_pajuelo_and_javier_antonio_quinones_the_one_thing_stopping_jellyfish_from_taking_over
495841,bo_cerup_simonsen_why_rivals_are_working_together_to_transform_shipping,Bo Cerup-Simonsen,Why rivals are working together to transform shipping,https://www.ted.com/talks/bo_cerup_simonsen_why_rivals_are_working_together_to_transform_shipping
495838,morten_bo_christiansen_the_first_ever_cargo_ship_powered_by_green_fuel,Morten Bo Christiansen,The first-ever cargo ship powered by green fuel,https://www.ted.com/talks/morten_bo_christiansen_the_first_ever_cargo_ship_powered_by_green_fuel
499137,virginia_santy_how_to_design_workplaces_cities_for_women,Virginia Santy,How to design workplaces & cities for women,https://www.ted.com/talks/virginia_santy_how_to_design_workplaces_cities_for_women
495834,yat_siu_the_dream_of_digital_ownership_powered_by_the_metaverse,Yat Siu,"The dream of digital ownership, powered by the metaverse",https://www.ted.com/talks/yat_siu_the_dream_of_digital_ownership_powered_by_the_metaverse
495808,stuart_kauffman_the_adjacent_possible_and_how_it_explains_human_innovation,Stuart Kauffman,"The ""adjacent possible"" — and how it explains human innovation",https://www.ted.com/talks/stuart_kauffman_the_adjacent_possible_and_how_it_explains_human_innovation
496163,kenny_coogan_can_alligators_survive_this_apex_predator,Kenny Coogan,Can alligators survive this apex predator?,https://www.ted.com/talks/kenny_coogan_can_alligators_survive_this_apex_predator
497791,refik_anadol_how_ai_art_could_enhance_humanity_s_collective_memory,Refik Anadol,How AI art could enhance humanity's collective memory,https://www.ted.com/talks/refik_anadol_how_ai_art_could_enhance_humanity_s_collective_memory
495821,ersin_han_ersin_what_s_it_like_to_be_a_giant_sequoia_tree,Ersin Han Ersin,What's it like to be a giant sequoia tree?,https://www.ted.com/talks/ersin_han_ersin_what_s_it_like_to_be_a_giant_sequoia_tree
496983,carolyn_beans_is_plant_based_meat_actually_better_for_you,Carolyn Beans,Is plant-based meat actually better for you?,https://www.ted.com/talks/carolyn_beans_is_plant_based_meat_actually_better_for_you
494331,olivia_breese_the_molecular_love_story_that_could_help_power_the_world,Olivia Breese,The molecular love story that could help power the world,https://www.ted.com/talks/olivia_breese_the_molecular_love_story_that_could_help_power_the_world
495814,yvonne_newbold_how_to_meet_your_child_s_difficult_behavior_with_compassion,Yvonne Newbold,How to meet your child's difficult behavior with compassion,https://www.ted.com/talks/yvonne_newbold_how_to_meet_your_child_s_difficult_behavior_with_compassion
496165,albert_zink_a_5_300_year_old_murder_mystery,Albert Zink,"A 5,300-year-old murder mystery",https://www.ted.com/talks/albert_zink_a_5_300_year_old_murder_mystery
495804,avinash_persaud_the_climate_crisis_is_expensive_here_s_who_should_pay_for_it,Avinash Persaud,The climate crisis is expensive — here's who should pay for it,https://www.ted.com/talks/avinash_persaud_the_climate_crisis_is_expensive_here_s_who_should_pay_for_it
479512,taylor_cassidy_why_real_change_is_about_more_than_just_going_viral,Taylor Cassidy,Why real change is about more than just going viral,https://www.ted.com/talks/taylor_cassidy_why_real_change_is_about_more_than_just_going_viral
496164,francis_de_los_reyes_how_the_water_you_flush_becomes_the_water_you_drink,Francis de los Reyes,How the water you flush becomes the water you drink,https://www.ted.com/talks/francis_de_los_reyes_how_the_water_you_flush_becomes_the_water_you_drink
491817,terry_moore_a_mysterious_design_that_appears_across_millennia,Terry Moore,A mysterious design that appears across millennia,https://www.ted.com/talks/terry_moore_a_mysterious_design_that_appears_across_millennia
494338,barbara_f_walter_is_the_us_headed_towards_another_civil_war,Barbara F. Walter,Is the US headed towards another civil war?,https://www.ted.com/talks/barbara_f_walter_is_the_us_headed_towards_another_civil_war
495555,coleman_hughes_and_jamelle_bouie_does_color_blindness_perpetuate_racism,Coleman Hughes and Jamelle Bouie,Does color blindness perpetuate racism?,https://www.ted.com/talks/coleman_hughes_and_jamelle_bouie_does_color_blindness_perpetuate_racism
481717,tolliver_say_what_nervous, Tolliver,"""Say What!"" / ""Nervous""",https://www.ted.com/talks/tolliver_say_what_nervous
496286,how_to_be_a_better_human_how_labor_unions_create_worker_power,How to Be a Better Human,How labor unions create worker power,https://www.ted.com/talks/how_to_be_a_better_human_how_labor_unions_create_worker_power
492716,fabio_pacucci_why_is_everyone_fighting_over_these_tiny_spots_of_space,Fabio Pacucci,Why is everyone fighting over these tiny spots of space?,https://www.ted.com/talks/fabio_pacucci_why_is_everyone_fighting_over_these_tiny_spots_of_space
496484,how_to_be_a_better_human_how_to_stop_finding_your_self_worth_through_your_job,How to Be a Better Human,How to stop finding your self-worth through your job,https://www.ted.com/talks/how_to_be_a_better_human_how_to_stop_finding_your_self_worth_through_your_job
493575,sandersan_onie_how_targeted_ads_might_just_save_your_life,Sandersan Onie,How targeted ads might just save your life,https://www.ted.com/talks/sandersan_onie_how_targeted_ads_might_just_save_your_life
493852,lindsay_demarchi_what_happens_if_you_don_t_put_your_phone_in_airplane_mode,Lindsay DeMarchi,What happens if you don't put your phone in airplane mode?,https://www.ted.com/talks/lindsay_demarchi_what_happens_if_you_don_t_put_your_phone_in_airplane_mode
494095,eileen_isagon_skyers_in_the_age_of_ai_art_what_can_originality_look_like,Eileen Isagon Skyers,"In the age of AI art, what can originality look like?",https://www.ted.com/talks/eileen_isagon_skyers_in_the_age_of_ai_art_what_can_originality_look_like
496173,andrei_adam_how_to_retain_gen_z_talent,Andrei Adam,How to retain Gen Z talent,https://www.ted.com/talks/andrei_adam_how_to_retain_gen_z_talent
494013,al_gore_what_the_fossil_fuel_industry_doesn_t_want_you_to_know,Al Gore,What the fossil fuel industry doesn't want you to know,https://www.ted.com/talks/al_gore_what_the_fossil_fuel_industry_doesn_t_want_you_to_know
495686,design_matters_with_debbie_millman_design_matters_megan_rapinoe,Design Matters with Debbie Millman,Design Matters: Megan Rapinoe,https://www.ted.com/talks/design_matters_with_debbie_millman_design_matters_megan_rapinoe
494379,michael_sheen_the_magic_of_a_creative_career,Michael Sheen,The magic of a creative career,https://www.ted.com/talks/michael_sheen_the_magic_of_a_creative_career
493378,george_zaidan_why_your_phone_battery_gets_worse_over_time,George Zaidan,Why your phone battery gets worse over time,https://www.ted.com/talks/george_zaidan_why_your_phone_battery_gets_worse_over_time
492845,simon_stiell_climate_action_is_on_the_cusp_of_exponential_growth,Simon Stiell,Climate action is on the cusp of exponential growth,https://www.ted.com/talks/simon_stiell_climate_action_is_on_the_cusp_of_exponential_growth
494088,lucas_rizzotto_why_i_built_my_own_time_machine,Lucas Rizzotto,Why I built my own time machine,https://www.ted.com/talks/lucas_rizzotto_why_i_built_my_own_time_machine
493795,misan_harriman_the_power_of_an_image_and_the_mind_behind_it,Misan Harriman,The power of an image — and the mind behind it,https://www.ted.com/talks/misan_harriman_the_power_of_an_image_and_the_mind_behind_it
492241,beatrice_k_otto_how_dangerous_was_it_to_be_a_jester,Beatrice K. Otto,How dangerous was it to be a jester?,https://www.ted.com/talks/beatrice_k_otto_how_dangerous_was_it_to_be_a_jester
492834,vinu_daniel_the_beauty_of_building_with_mud_and_trash,Vinu Daniel,The beauty of building with mud and trash,https://www.ted.com/talks/vinu_daniel_the_beauty_of_building_with_mud_and_trash
493967,coleman_hughes_a_case_for_color_blindness,Coleman Hughes,A case for color blindness,https://www.ted.com/talks/coleman_hughes_a_case_for_color_blindness
490015,andrew_leland_blindness_isn_t_a_tragic_binary_it_s_a_rich_spectrum,Andrew Leland,Blindness isn't a tragic binary — it's a rich spectrum,https://www.ted.com/talks/andrew_leland_blindness_isn_t_a_tragic_binary_it_s_a_rich_spectrum
493377,ted_ed_how_to_enter_flow_state,TED-Ed,How to enter flow state,https://www.ted.com/talks/ted_ed_how_to_enter_flow_state
493910,steve_presley_can_global_food_companies_make_the_shift_to_regenerative_agriculture,Steve Presley,Can global food companies make the shift to regenerative agriculture?,https://www.ted.com/talks/steve_presley_can_global_food_companies_make_the_shift_to_regenerative_agriculture
490774,garry_cooper_how_to_make_sure_materials_get_reused_again_and_again,Garry Cooper,How to make sure materials get reused — again and again,https://www.ted.com/talks/garry_cooper_how_to_make_sure_materials_get_reused_again_and_again
492048,siska_de_baerdemaeker_3_questions_to_ask_yourself_before_you_believe_something,Siska De Baerdemaeker,3 questions to ask yourself before you believe something,https://www.ted.com/talks/siska_de_baerdemaeker_3_questions_to_ask_yourself_before_you_believe_something
492829,maya_shankar_why_change_is_so_scary_and_how_to_unlock_its_potential,Maya Shankar,Why change is so scary — and how to unlock its potential,https://www.ted.com/talks/maya_shankar_why_change_is_so_scary_and_how_to_unlock_its_potential
492823,wanjira_mathai_the_tree_growing_movement_restoring_africa_s_vital_landscapes,Wanjira Mathai,The tree-growing movement restoring Africa's vital landscapes,https://www.ted.com/talks/wanjira_mathai_the_tree_growing_movement_restoring_africa_s_vital_landscapes
490050,stephanie_honchell_smith_the_rise_and_fall_of_italy_s_warriors_for_hire,Stephanie Honchell Smith,The rise and fall of Italy’s warriors-for-hire,https://www.ted.com/talks/stephanie_honchell_smith_the_rise_and_fall_of_italy_s_warriors_for_hire
492256,david_lammy_and_justin_j_pearson_how_to_be_a_leader_for_climate_justice,David Lammy and Justin J. Pearson,How to be a leader for climate justice,https://www.ted.com/talks/david_lammy_and_justin_j_pearson_how_to_be_a_leader_for_climate_justice
485565,george_t_whitesides_the_growing_megafire_crisis_and_how_to_contain_it,George T. Whitesides,The growing megafire crisis — and how to contain it,https://www.ted.com/talks/george_t_whitesides_the_growing_megafire_crisis_and_how_to_contain_it
490107,anneliese_mehnert_one_of_history_s_most_dangerous_myths,Anneliese Mehnert,One of history's most dangerous myths,https://www.ted.com/talks/anneliese_mehnert_one_of_history_s_most_dangerous_myths
491686,mark_mortensen_is_remote_work_better_than_being_in_the_office_it_s_complicated,Mark Mortensen,Is remote work better than being in the office? It's complicated,https://www.ted.com/talks/mark_mortensen_is_remote_work_better_than_being_in_the_office_it_s_complicated
489763,karen_bakker_could_an_orca_give_a_ted_talk,Karen Bakker,Could an orca give a TED Talk?,https://www.ted.com/talks/karen_bakker_could_an_orca_give_a_ted_talk
488641,nicole_rycroft_why_are_we_making_pizza_boxes_out_of_endangered_trees,Nicole Rycroft,Why are we making pizza boxes out of endangered trees?,https://www.ted.com/talks/nicole_rycroft_why_are_we_making_pizza_boxes_out_of_endangered_trees
492196,the_redemption_of_jar_jar_binks_episode_1_the_internet_s_first_main_character,The Redemption of Jar Jar Binks,Episode 1: The Internet's First Main Character?,https://www.ted.com/talks/the_redemption_of_jar_jar_binks_episode_1_the_internet_s_first_main_character
484718,shannon_odell_what_s_happening_to_earth_s_core,Shannon Odell,What's happening to Earth's core?,https://www.ted.com/talks/shannon_odell_what_s_happening_to_earth_s_core
492090,anika_goss_detroit_s_climate_crisis_and_how_to_build_a_resilient_future_everywhere,Anika Goss,Detroit's climate crisis — and how to build a resilient future everywhere,https://www.ted.com/talks/anika_goss_detroit_s_climate_crisis_and_how_to_build_a_resilient_future_everywhere
491975,maxim_timchenko_the_renewable_energy_revolution_happening_in_ukraine,Maxim Timchenko,The renewable energy revolution happening in Ukraine,https://www.ted.com/talks/maxim_timchenko_the_renewable_energy_revolution_happening_in_ukraine
490105,barbara_j_king_can_other_animals_understand_death,Barbara J. King,Can other animals understand death?,https://www.ted.com/talks/barbara_j_king_can_other_animals_understand_death
489758,eliezer_yudkowsky_will_superintelligent_ai_end_the_world,Eliezer Yudkowsky,Will superintelligent AI end the world?,https://www.ted.com/talks/eliezer_yudkowsky_will_superintelligent_ai_end_the_world
487525,alexandr_wang_war_ai_and_the_new_global_arms_race,Alexandr Wang,"War, AI and the new global arms race",https://www.ted.com/talks/alexandr_wang_war_ai_and_the_new_global_arms_race
491499,alex_budak_you_don_t_have_to_be_a_ceo_to_be_a_leader,Alex Budak,You don't have to be a CEO to be a leader,https://www.ted.com/talks/alex_budak_you_don_t_have_to_be_a_ceo_to_be_a_leader
487521,angeline_murimirwa_school_is_just_the_start_here_s_how_to_help_girls_succeed_for_life,Angeline Murimirwa,School is just the start. Here's how to help girls succeed for life,https://www.ted.com/talks/angeline_murimirwa_school_is_just_the_start_here_s_how_to_help_girls_succeed_for_life
481359,alua_arthur_why_thinking_about_death_helps_you_live_a_better_life,Alua Arthur,Why thinking about death helps you live a better life,https://www.ted.com/talks/alua_arthur_why_thinking_about_death_helps_you_live_a_better_life
490106,daniel_finkel_can_you_solve_the_time_traveling_car_riddle,Daniel Finkel,Can you solve the time traveling car riddle?,https://www.ted.com/talks/daniel_finkel_can_you_solve_the_time_traveling_car_riddle
490113,shane_campbell_staton_how_life_on_earth_adapts_to_you_and_me,Shane Campbell-Staton,How life on Earth adapts to you and me,https://www.ted.com/talks/shane_campbell_staton_how_life_on_earth_adapts_to_you_and_me
490296,johann_daniel_harnoss_how_your_company_can_gain_a_global_talent_advantage,Johann Daniel Harnoss,How your company can gain a global talent advantage,https://www.ted.com/talks/johann_daniel_harnoss_how_your_company_can_gain_a_global_talent_advantage
488026,jack_cooper_and_catalina_pimiento_why_did_megalodon_go_extinct,Jack Cooper and Catalina Pimiento,Why did Megalodon go extinct?,https://www.ted.com/talks/jack_cooper_and_catalina_pimiento_why_did_megalodon_go_extinct
489754,machine_dazzle_how_to_unleash_your_inner_maximalist_through_costume,Machine Dazzle,How to unleash your inner maximalist through costume,https://www.ted.com/talks/machine_dazzle_how_to_unleash_your_inner_maximalist_through_costume
489899,how_to_be_a_better_human_how_to_embrace_and_challenge_the_idea_of_beauty_w_elise_hu,How to Be a Better Human,"How to embrace – and challenge – the idea of ""beauty"" (w/ Elise Hu)",https://www.ted.com/talks/how_to_be_a_better_human_how_to_embrace_and_challenge_the_idea_of_beauty_w_elise_hu
488439,fabio_pacucci_gravity_vs_pressure_the_battle_that_formed_the_universe,Fabio Pacucci,Gravity vs. Pressure: The battle that formed the universe,https://www.ted.com/talks/fabio_pacucci_gravity_vs_pressure_the_battle_that_formed_the_universe
489889,jioji_ravulo_a_liberating_vision_of_identity_that_transcends_labels,Jioji Ravulo,A liberating vision of identity that transcends labels,https://www.ted.com/talks/jioji_ravulo_a_liberating_vision_of_identity_that_transcends_labels
476204,rebecca_darwent_how_to_fund_real_change_in_your_community,Rebecca Darwent,How to fund real change in your community,https://www.ted.com/talks/rebecca_darwent_how_to_fund_real_change_in_your_community
487161,susanne_buckley_zistel_what_caused_the_rwandan_genocide,Susanne Buckley-Zistel,What caused the Rwandan Genocide?,https://www.ted.com/talks/susanne_buckley_zistel_what_caused_the_rwandan_genocide
489512,conor_russomanno_a_powerful_new_neurotech_tool_for_augmenting_your_mind,Conor Russomanno,A powerful new neurotech tool for augmenting your mind,https://www.ted.com/talks/conor_russomanno_a_powerful_new_neurotech_tool_for_augmenting_your_mind
487964,peter_singer_a_modern_argument_for_the_rights_of_animals,Peter Singer,A modern argument for the rights of animals,https://www.ted.com/talks/peter_singer_a_modern_argument_for_the_rights_of_animals
489187,beatriz_villarroel_why_we_should_search_for_alien_artifacts,Beatriz Villarroel,Why we should search for alien artifacts,https://www.ted.com/talks/beatriz_villarroel_why_we_should_search_for_alien_artifacts
486262,sahar_zand_why_iranians_are_cutting_their_hair_for_woman_life_freedom,Sahar Zand,"Why Iranians are cutting their hair for ""Woman, Life, Freedom""",https://www.ted.com/talks/sahar_zand_why_iranians_are_cutting_their_hair_for_woman_life_freedom
483281,shannon_odell_should_you_switch_to_solar,Shannon Odell,Should you switch to solar?,https://www.ted.com/talks/shannon_odell_should_you_switch_to_solar
488426,p_seth_yelorda_why_you_need_help_finding_your_dream_job,P. Seth Yelorda,Why you need help finding your dream job,https://www.ted.com/talks/p_seth_yelorda_why_you_need_help_finding_your_dream_job
486413,angus_hervey_why_are_we_so_bad_at_reporting_good_news,Angus Hervey,Why are we so bad at reporting good news?,https://www.ted.com/talks/angus_hervey_why_are_we_so_bad_at_reporting_good_news
485443,sheryl_lee_ralph_a_3_step_guide_to_believing_in_yourself,Sheryl Lee Ralph,A 3-step guide to believing in yourself,https://www.ted.com/talks/sheryl_lee_ralph_a_3_step_guide_to_believing_in_yourself
484719,carolyn_harris_why_is_marie_antoinette_so_controversial,Carolyn Harris,Why is Marie Antoinette so controversial?,https://www.ted.com/talks/carolyn_harris_why_is_marie_antoinette_so_controversial
486912,rainn_wilson_kung_fu_star_trek_and_the_many_paths_to_spirituality,Rainn Wilson,"Kung Fu, Star Trek and the many paths to spirituality",https://www.ted.com/talks/rainn_wilson_kung_fu_star_trek_and_the_many_paths_to_spirituality
486419,richard_reeves_how_to_solve_the_education_crisis_for_boys_and_men,Richard Reeves,How to solve the education crisis for boys and men,https://www.ted.com/talks/richard_reeves_how_to_solve_the_education_crisis_for_boys_and_men
485107,mena_fombo_no_you_cannot_touch_my_hair_sep_2023,Mena Fombo,No. You cannot touch my hair!,https://www.ted.com/talks/mena_fombo_no_you_cannot_touch_my_hair_sep_2023
483282,iseult_gillespie_who_is_the_fastest_god_in_all_mythology,Iseult Gillespie,Who is the fastest god in all mythology?,https://www.ted.com/talks/iseult_gillespie_who_is_the_fastest_god_in_all_mythology
474192,cohen_bradley_how_to_weave_a_cultural_legacy_through_storytelling,Cohen Bradley,How to weave a cultural legacy through storytelling,https://www.ted.com/talks/cohen_bradley_how_to_weave_a_cultural_legacy_through_storytelling
486878,orit_peleg_how_fireflies_communicate,Orit Peleg,How fireflies communicate,https://www.ted.com/talks/orit_peleg_how_fireflies_communicate
483764,ian_bremmer_the_next_global_superpower_isn_t_who_you_think,Ian Bremmer,The next global superpower isn't who you think,https://www.ted.com/talks/ian_bremmer_the_next_global_superpower_isn_t_who_you_think
486395,karleen_savage_a_hostage_negotiator_on_how_to_resolve_conflict,Karleen Savage,A hostage negotiator on how to resolve conflict,https://www.ted.com/talks/karleen_savage_a_hostage_negotiator_on_how_to_resolve_conflict
486014,jessie_reyez_still_c_u_figures,Jessie Reyez,"""STILL C U"" / ""Figures""",https://www.ted.com/talks/jessie_reyez_still_c_u_figures
485226,susan_g_wardle_what_it_means_if_you_can_see_faces_in_objects,Susan G. Wardle,What it means if you can see faces in objects,https://www.ted.com/talks/susan_g_wardle_what_it_means_if_you_can_see_faces_in_objects
485106,mark_edwards_why_is_it_so_hard_to_get_effective_birth_control_in_the_us,Mark Edwards,Why is it so hard to get effective birth control in the US?,https://www.ted.com/talks/mark_edwards_why_is_it_so_hard_to_get_effective_birth_control_in_the_us
